product_id,product_name,category
1,White Hanging Heart T-Light Holder,Holders & Stands
2,white metal lantern,Lighting
3,CREAM CUPID HEARTS COAT HANGER,Storage & Organization
4,KNITTED UNION FLAG HOT WATER BOTTLE,Drinkware
5,Red Woolly Hottie White Heart.,Decorative Items
6,set 7 babushka nesting boxes,Bags & Boxes
7,glass star frosted t-light holder,Holders & Stands
8,HAND WARMER UNION JACK,Other/Unknown
9,HAND WARMER RED POLKA DOT,Other/Unknown
10,assorted colour bird ornament,Other/Unknown
11,Poppy'S Playhouse Bedroom ,Other/Unknown
12,poppy's playhouse kitchen,Other/Unknown
13,FELTCRAFT PRINCESS CHARLOTTE DOLL,Other/Unknown
14,IVORY KNITTED MUG COSY ,Drinkware
15,box of 6 assorted colour teaspoons,Bags & Boxes
16,Box Of Vintage Jigsaw Blocks ,Bags & Boxes
17,Box Of Vintage Alphabet Blocks,Bags & Boxes
18,Home Building Block Word,Other/Unknown
19,Love Building Block Word,Other/Unknown
20,Recipe Box With Metal Heart,Bags & Boxes
21,Doormat New England,Other/Unknown
22,jam making set with jars,Other/Unknown
23,red coat rack paris fashion,Other/Unknown
24,YELLOW COAT RACK PARIS FASHION,Other/Unknown
25,BLUE COAT RACK PARIS FASHION,Other/Unknown
26,bath building block word,Other/Unknown
27,PAPER CHAIN KIT 50'S CHRISTMAS ,Other/Unknown
28,Hand Warmer Red Polka Dot,Other/Unknown
29,Hand Warmer Union Jack,Other/Unknown
30,WHITE HANGING HEART T-LIGHT HOLDER,Holders & Stands
31,White Metal Lantern,Lighting
32,cream cupid hearts coat hanger,Storage & Organization
33,edwardian parasol red,Other/Unknown
34,retro coffee mugs assorted,Drinkware
35,SAVE THE PLANET MUG,Drinkware
36,VINTAGE BILLBOARD DRINK ME MUG,Drinkware
37,Vintage Billboard Love/Hate Mug,Drinkware
38,Wood 2 Drawer Cabinet White Finish,Other/Unknown
39,WOOD S/3 CABINET ANT WHITE FINISH,Other/Unknown
40,Wooden Picture Frame White Finish,Other/Unknown
41,wooden frame antique white ,Vintage Items
42,Knitted Union Flag Hot Water Bottle,Drinkware
43,RED WOOLLY HOTTIE WHITE HEART.,Decorative Items
44,GLASS STAR FROSTED T-LIGHT HOLDER,Holders & Stands
45,victorian sewing box large,Bags & Boxes
46,white hanging heart t-light holder,Holders & Stands
47,WHITE METAL LANTERN,Lighting
48,Cream Cupid Hearts Coat Hanger,Storage & Organization
49,Edwardian Parasol Red,Other/Unknown
50,RETRO COFFEE MUGS ASSORTED,Drinkware
51,save the planet mug,Drinkware
52,Vintage Billboard Drink Me Mug,Drinkware
53,WOOD 2 DRAWER CABINET WHITE FINISH,Other/Unknown
54,Wood S/3 Cabinet Ant White Finish,Other/Unknown
55,WOODEN PICTURE FRAME WHITE FINISH,Other/Unknown
56,knitted union flag hot water bottle,Drinkware
57,Hot Water Bottle Tea And Sympathy,Drinkware
58,red hanging heart t-light holder,Holders & Stands
59,Jumbo Bag Pink Polkadot,Bags & Boxes
60,JUMBO  BAG BAROQUE BLACK WHITE,Bags & Boxes
61,jumbo bag charlie and lola toys,Bags & Boxes
62,STRAWBERRY CHARLOTTE BAG,Bags & Boxes
63,Red 3 Piece Retrospot Cutlery Set,Other/Unknown
64,Blue 3 Piece Polkadot Cutlery Set,Other/Unknown
65,SET/6 RED SPOTTY PAPER PLATES,Other/Unknown
66,LUNCH BAG RED RETROSPOT,Bags & Boxes
67,STRAWBERRY LUNCH BOX WITH CUTLERY,Bags & Boxes
68,LUNCH BOX WITH CUTLERY RETROSPOT ,Bags & Boxes
69,Pack Of 72 Retrospot Cake Cases,Other/Unknown
70,pack of 60 dinosaur cake cases,Other/Unknown
71,Pack Of 60 Pink Paisley Cake Cases,Other/Unknown
72,60 teatime fairy cake cases,Other/Unknown
73,TOMATO CHARLIE+LOLA COASTER SET,Other/Unknown
74,charlie & lola wastepaper bin flora,Other/Unknown
75,red charlie+lola personal doorsign,Other/Unknown
76,Jumbo Storage Bag Suki,Bags & Boxes
77,Jumbo Bag Pink Vintage Paisley,Bags & Boxes
78,Jam Making Set Printed,Other/Unknown
79,RETROSPOT TEA SET CERAMIC 11 PC ,Other/Unknown
80,Girly Pink Tool Set,Other/Unknown
81,Jumbo Shopper Vintage Red Paisley,Vintage Items
82,"Airline Lounge,Metal Sign",Other/Unknown
83,white spot red ceramic drawer knob,Other/Unknown
84,Red Drawer Knob Acrylic Edwardian,Other/Unknown
85,Clear Drawer Knob Acrylic Edwardian,Other/Unknown
86,photo clip line,Other/Unknown
87,FELT EGG COSY CHICKEN,Other/Unknown
88,PIGGY BANK RETROSPOT ,Other/Unknown
89,SKULL SHOULDER BAG,Bags & Boxes
90,You'Re Confusing Me Metal Sign ,Other/Unknown
91,COOK WITH WINE METAL SIGN ,Other/Unknown
92,GIN + TONIC DIET METAL SIGN,Other/Unknown
93,yellow breakfast cup and saucer,Drinkware
94,PINK BREAKFAST CUP AND SAUCER ,Drinkware
95,paper chain kit 50's christmas ,Other/Unknown
96,Paper Chain Kit Retrospot,Other/Unknown
97,SMALL HEART FLOWERS HOOK ,Storage & Organization
98,PHOTO CLIP LINE,Other/Unknown
99,TEA TIME DES TEA COSY,Other/Unknown
100,FELT EGG COSY WHITE RABBIT ,Other/Unknown
101,ZINC WILLIE WINKIE  CANDLE STICK,Candles
102,ceramic cherry cake money bank,Other/Unknown
103,Retrospot Large Milk Jug,Other/Unknown
104,SET OF 6 FUNKY BEAKERS,Other/Unknown
105,EDWARDIAN PARASOL BLACK,Other/Unknown
106,Edwardian Parasol Natural,Other/Unknown
107,CERAMIC STRAWBERRY CAKE MONEY BANK,Other/Unknown
108,Blue Owl Soft Toy,Toys & Games
109,balloon art make your own flowers,Decorative Items
110,RED TOADSTOOL LED NIGHT LIGHT,Lighting
111,GLASS CLOCHE SMALL,Other/Unknown
112,gumball monochrome coat rack,Other/Unknown
113,doormat fancy font home sweet home,Other/Unknown
114,inflatable political globe ,Other/Unknown
115,VINTAGE SNAKES & LADDERS,Vintage Items
116,Chocolate Calculator,Other/Unknown
117,RECYCLING BAG RETROSPOT ,Bags & Boxes
118,Toy Tidy Pink Polkadot,Toys & Games
119,antique glass dressing table pot,Vintage Items
120,ALARM CLOCK BAKELIKE GREEN,Clocks
121,IVORY GIANT GARDEN THERMOMETER,Other/Unknown
122,3 Tier Cake Tin Green And Cream,Other/Unknown
123,3 tier cake tin red and cream,Other/Unknown
124,Set 3 Wicker Oval Baskets W Lids,Other/Unknown
125,Wood Black Board Ant White Finish,Other/Unknown
126,COLOUR GLASS T-LIGHT HOLDER HANGING,Holders & Stands
127,hanging metal heart lantern,Lighting
128,hanging medina lantern small,Lighting
129,NATURAL SLATE HEART CHALKBOARD ,Decorative Items
130,Heart Of Wicker Small,Decorative Items
131,Heart Of Wicker Large,Decorative Items
132,WHITE LOVEBIRD LANTERN,Lighting
133,Classic Metal Birdcage Plant Holder,Holders & Stands
134,cream heart card holder,Holders & Stands
135,ENAMEL FLOWER JUG CREAM,Decorative Items
136,ENAMEL FIRE BUCKET CREAM,Other/Unknown
137,Enamel Bread Bin Cream,Other/Unknown
138,SET 3 WICKER OVAL BASKETS W LIDS,Other/Unknown
139,JAM MAKING SET WITH JARS,Other/Unknown
140,Jumbo Bag Dolly Girl Design,Bags & Boxes
141,TRADITIONAL CHRISTMAS RIBBONS,Other/Unknown
142,Organiser Wood Antique White ,Vintage Items
143,lunch bag dolly girl design,Bags & Boxes
144,WHITE WIRE EGG HOLDER,Holders & Stands
145,jumbo bag red retrospot,Bags & Boxes
146,CHILLI LIGHTS,Lighting
147,light garland butterfiles pink,Lighting
148,wooden owls light garland ,Lighting
149,FAIRY TALE COTTAGE NIGHTLIGHT,Lighting
150,HOME BUILDING BLOCK WORD,Other/Unknown
151,Doormat Fancy Font Home Sweet Home,Other/Unknown
152,home small wood letters,Other/Unknown
153,Gingham Heart  Doorstop Red,Decorative Items
154,FIVE HEART HANGING DECORATION,Decorative Items
155,Assorted Bottle Top  Magnets ,Drinkware
156,Fridge Magnets Us Diner Assorted,Other/Unknown
157,homemade jam scented candles,Candles
158,fridge magnets les enfants assorted,Other/Unknown
159,rose caravan doorstop,Other/Unknown
160,5 HOOK HANGER MAGIC TOADSTOOL,Storage & Organization
161,Christmas Lights 10 Reindeer,Lighting
162,Jam Making Set With Jars,Other/Unknown
163,Jam Jar With Pink Lid,Other/Unknown
164,JAM JAR WITH GREEN LID,Other/Unknown
165,ROSE COTTAGE KEEPSAKE BOX ,Bags & Boxes
166,Hanging Heart Zinc T-Light Holder,Holders & Stands
167,paper chain kit vintage christmas,Vintage Items
168,disco ball christmas decoration,Decorative Items
169,small popcorn holder,Holders & Stands
170,large popcorn holder ,Holders & Stands
171,RETROSPOT LARGE MILK JUG,Other/Unknown
172,Set/20 Red Retrospot Paper Napkins ,Other/Unknown
173,Set/6 Red Spotty Paper Plates,Other/Unknown
174,set/6 red spotty paper cups,Drinkware
175,Polkadot Rain Hat ,Other/Unknown
176,deluxe sewing kit ,Other/Unknown
177,RETROSPOT HEART HOT WATER BOTTLE,Drinkware
178,English Rose Hot Water Bottle,Drinkware
179,PHOTO CUBE,Other/Unknown
180,HOMEMADE JAM SCENTED CANDLES,Candles
181,Jumbo Bag Red Retrospot,Bags & Boxes
182,3 stripey mice feltcraft,Other/Unknown
183,SET OF 6 SOLDIER SKITTLES,Other/Unknown
184,TRADITIONAL WOODEN SKIPPING ROPE,Other/Unknown
185,wooden box of dominoes,Bags & Boxes
186,rustic  seventeen drawer sideboard,Other/Unknown
187,Party Cones Carnival Assorted,Other/Unknown
188,PARTY CONES CANDY ASSORTED,Other/Unknown
189,Picnic Basket Wicker Small,Other/Unknown
190,ASSORTED COLOUR BIRD ORNAMENT,Other/Unknown
191,star decoration painted zinc ,Decorative Items
192,RETROSPOT LAMP,Other/Unknown
193,"FANCY FONT BIRTHDAY CARD, ",Gifts & Cards
194,hand warmer union jack,Other/Unknown
195,HAND WARMER SCOTTY DOG DESIGN,Other/Unknown
196,Hand Warmer Owl Design,Other/Unknown
197,Hand Warmer Red Retrospot,Other/Unknown
198,Retrospot Heart Hot Water Bottle,Drinkware
199,dog bowl chasing ball design,Other/Unknown
200,clothes pegs retrospot pack 24 ,Other/Unknown
201,HAND OVER THE CHOCOLATE   SIGN ,Other/Unknown
202,travel sewing kit,Other/Unknown
203,BLACK HEART CARD HOLDER,Holders & Stands
204,pack of 60 pink paisley cake cases,Other/Unknown
205,Chick Grey Hot Water Bottle,Drinkware
206,small glass heart trinket pot,Decorative Items
207,alarm clock bakelike ivory,Clocks
208,alarm clock bakelike red ,Clocks
209,alarm clock bakelike orange,Clocks
210,alarm clock bakelike green,Clocks
211,hot water bottle tea and sympathy,Drinkware
212,HAND WARMER BIRD DESIGN,Other/Unknown
213,hand warmer scotty dog design,Other/Unknown
214,edwardian parasol black,Other/Unknown
215,Retro Coffee Mugs Assorted,Drinkware
216,VINTAGE BILLBOARD LOVE/HATE MUG,Drinkware
217,Wooden Frame Antique White ,Vintage Items
218,Set 7 Babushka Nesting Boxes,Bags & Boxes
219,ivory embroidered quilt ,Other/Unknown
220,Glass Star Frosted T-Light Holder,Holders & Stands
221,SET OF 3 BLACK FLYING DUCKS,Other/Unknown
222,Set Of 3 Coloured  Flying Ducks,Other/Unknown
223,PACK OF 12 RED RETROSPOT TISSUES ,Other/Unknown
224,Red Retrospot Mug,Drinkware
225,babushka lights string of 10,Lighting
226,piggy bank retrospot ,Other/Unknown
227,DOORMAT FAIRY CAKE,Other/Unknown
228,HAND WARMER RED RETROSPOT,Other/Unknown
229,hand warmer owl design,Other/Unknown
230,STRAWBERRY CERAMIC TRINKET BOX,Bags & Boxes
231,pink doughnut trinket pot ,Other/Unknown
232,Silk Purse Babushka Pink,Other/Unknown
233,HOT WATER BOTTLE TEA AND SYMPATHY,Drinkware
234,Hot Water Bottle I Am So Poorly,Drinkware
235,chocolate hot water bottle,Drinkware
236,white skull hot water bottle ,Drinkware
237,SCOTTIE DOG HOT WATER BOTTLE,Drinkware
238,Bird House Hot Water Bottle,Drinkware
239,boudoir square tissue box,Bags & Boxes
240,skulls square tissue box,Bags & Boxes
241,photo frame cornice,Other/Unknown
242,Silk Purse Babushka Red,Other/Unknown
243,picture dominoes,Other/Unknown
244,S/6 Sew On Crochet Flowers,Decorative Items
245,scandinavian reds ribbons,Other/Unknown
246,balloons  writing set ,Other/Unknown
247,jam making set printed,Other/Unknown
248,Lavender Incense In Tin,Other/Unknown
249,Tv Dinner Tray Vintage Paisley,Vintage Items
250,SET OF 4 ENGLISH ROSE PLACEMATS,Other/Unknown
251,SET OF 4 ENGLISH ROSE COASTERS,Other/Unknown
252,triple photo frame cornice ,Other/Unknown
253,FAMILY PHOTO FRAME CORNICE,Other/Unknown
254,mirrored disco ball ,Other/Unknown
255,Disco Ball Rotator Battery Operated,Other/Unknown
256,Silver Looking Mirror,Other/Unknown
257,LADIES & GENTLEMEN METAL SIGN,Other/Unknown
258,Metal Sign Her Dinner Is Served ,Other/Unknown
259,YOU'RE CONFUSING ME METAL SIGN ,Other/Unknown
260,doormat topiary,Other/Unknown
261,bathroom metal sign,Other/Unknown
262,Kitchen Metal Sign,Other/Unknown
263,TOILET METAL SIGN,Other/Unknown
264,metal sign take it or leave it ,Other/Unknown
265,I'M ON HOLIDAY METAL SIGN,Other/Unknown
266,GROW YOUR OWN BASIL IN ENAMEL MUG,Drinkware
267,Set/10 Pink Polkadot Party Candles,Candles
268,SET 20 NAPKINS FAIRY CAKES DESIGN ,Other/Unknown
269,60 Teatime Fairy Cake Cases,Other/Unknown
270,Set Of 6 T-Lights Snowmen,Lighting
271,set of 6 t-lights santa,Lighting
272,Set Of 9 Heart Shaped Balloons,Decorative Items
273,SANDWICH BATH SPONGE,Other/Unknown
274,Apple Bath Sponge,Other/Unknown
275,strawberry bath sponge ,Other/Unknown
276,Black Pirate Treasure Chest,Other/Unknown
277,star portable table light ,Lighting
278,Snowflake Portable Table Light ,Lighting
279,pink oval jewelled mirror,Other/Unknown
280,RETROSPOT CIGAR BOX MATCHES ,Bags & Boxes
281,Cosy Hour Giant Tube Matches,Other/Unknown
282,JAZZ HEARTS PURSE NOTEBOOK,Decorative Items
283,LUNCH BAG DOLLY GIRL DESIGN,Bags & Boxes
284,candleholder pink hanging heart,Holders & Stands
285,assorted colour mini cases,Other/Unknown
286,lunch bag red retrospot,Bags & Boxes
287,lunch bag spaceboy design ,Bags & Boxes
288,LUNCH BAG WOODLAND,Bags & Boxes
289,lunch bag pink polkadot,Bags & Boxes
290,GUMBALL COAT RACK,Other/Unknown
291,blue new baroque candlestick candle,Candles
292,pink new baroquecandlestick candle,Candles
293,fairy cake flannel assorted colour,Other/Unknown
294,BREAD BIN DINER STYLE PINK,Other/Unknown
295,JUMBO BAG CHARLIE AND LOLA TOYS,Bags & Boxes
296,TEA TIME TABLE CLOTH,Other/Unknown
297,Enamel Fire Bucket Cream,Other/Unknown
298,hot water bottle babushka ,Drinkware
299,heart ivory trellis small,Decorative Items
300,Pink Drawer Knob Acrylic Edwardian,Other/Unknown
301,green drawer knob acrylic edwardian,Other/Unknown
302,blue drawer knob acrylic edwardian,Other/Unknown
303,heart of wicker small,Decorative Items
304,SET 6 FOOTBALL CELEBRATION CANDLES,Candles
305,SET OF 6 GIRLS CELEBRATION CANDLES,Candles
306,ROMANTIC PINKS RIBBONS ,Other/Unknown
307,BRIGHT BLUES RIBBONS ,Other/Unknown
308,SCANDINAVIAN REDS RIBBONS,Other/Unknown
309,CHOCOLATE BOX RIBBONS ,Bags & Boxes
310,Party Invites Football,Other/Unknown
311,PARTY INVITES JAZZ HEARTS,Decorative Items
312,PARTY INVITES SPACEMAN,Other/Unknown
313,set of 3 butterfly cookie cutters,Other/Unknown
314,SET OF 3 HEART COOKIE CUTTERS,Decorative Items
315,3 Piece Spaceboy Cookie Cutter Set,Other/Unknown
316,Pack Of 72 Skull Cake Cases,Other/Unknown
317,PACK OF 60 SPACEBOY CAKE CASES,Other/Unknown
318,pack of 72 retrospot cake cases,Other/Unknown
319,72 SWEETHEART FAIRY CAKE CASES,Decorative Items
320,PACK OF 60 DINOSAUR CAKE CASES,Other/Unknown
321,lunch bag suki  design ,Bags & Boxes
322,Lunch Bag Cars Blue,Bags & Boxes
323,LUNCH BAG  BLACK SKULL.,Bags & Boxes
324,heart ivory trellis large,Decorative Items
325,SET/5 RED RETROSPOT LID GLASS BOWLS,Other/Unknown
326,red woolly hottie white heart.,Decorative Items
327,IVORY EMBROIDERED QUILT ,Other/Unknown
328,magic drawing slate dinosaur,Other/Unknown
329,magic drawing slate bake a cake ,Other/Unknown
330,12 pencils tall tube skulls,Other/Unknown
331,chocolate calculator,Other/Unknown
332,red  harmonica in box ,Bags & Boxes
333,Blue Harmonica In Box ,Bags & Boxes
334,skulls  water transfer tattoos ,Other/Unknown
335,Pack 3 Boxes Bird Pannetone ,Bags & Boxes
336,White Skull Hot Water Bottle ,Drinkware
337,Set Of 20 Kids Cookie Cutters,Other/Unknown
338,10 Colour Spaceboy Pen,Other/Unknown
339,victorian glass hanging t-light,Lighting
340,Single Heart Zinc T-Light Holder,Holders & Stands
341,Red Hanging Heart T-Light Holder,Holders & Stands
342,HANGING METAL STAR LANTERN,Lighting
343,silver hanging t-light holder,Holders & Stands
344,DOORMAT RED RETROSPOT,Other/Unknown
345,DOORMAT HEARTS,Decorative Items
346,Natural Slate Rectangle Chalkboard,Other/Unknown
347,LOVEBIRD HANGING DECORATION WHITE ,Decorative Items
348,Assorted Colour Bird Ornament,Other/Unknown
349,PHOTO FRAME CORNICE,Other/Unknown
350,pens assorted funny face,Other/Unknown
351,card circus parade,Gifts & Cards
352,Wrap Cowboys  ,Other/Unknown
353,AIRLINE BAG VINTAGE TOKYO 78,Bags & Boxes
354,RED RETROSPOT UMBRELLA,Other/Unknown
355,Black/Blue Polkadot Umbrella,Other/Unknown
356,SET OF 72 RETROSPOT PAPER  DOILIES,Other/Unknown
357,Blue Coat Rack Paris Fashion,Other/Unknown
358,Plasters In Tin Skulls,Other/Unknown
359,sleeping cat erasers,Other/Unknown
360,Card Birthday Cowboy,Gifts & Cards
361,pack 3 boxes christmas pannetone,Bags & Boxes
362,Rotating Silver Angels T-Light Hldr,Lighting
363,cosy hour giant tube matches,Other/Unknown
364,RIBBON REEL MAKING SNOWMEN ,Other/Unknown
365,mini paint set vintage ,Vintage Items
366,4 Traditional Spinning Tops,Other/Unknown
367,Set Of 6 Soldier Skittles,Other/Unknown
368,Bag 500G Swirly Marbles,Bags & Boxes
369,5 STRAND GLASS NECKLACE CRYSTAL,Jewellery
370,scottie dog hot water bottle,Drinkware
371,SQUARECUSHION COVER PINK UNION FLAG,Other/Unknown
372,Spaceboy Childrens Egg Cup,Drinkware
373,CHILDREN'S SPACEBOY MUG,Drinkware
374,Hand Warmer Scotty Dog Design,Other/Unknown
375,feltcraft cushion owl,Other/Unknown
376,black candelabra t-light holder,Holders & Stands
377,Toy Tidy Dolly Girl Design,Toys & Games
378,set 12 lavender  botanical t-lights,Lighting
379,union jack flag luggage tag,Other/Unknown
380,red heart luggage tag,Decorative Items
381,red glass tassle bag charm,Bags & Boxes
382,CLEAR ACRYLIC FACETED BANGLE,Other/Unknown
383,doormat union jack guns and roses,Other/Unknown
384,vanilla scent candle jewelled box,Bags & Boxes
385,FULL ENGLISH BREAKFAST PLATE,Other/Unknown
386,Black Candelabra T-Light Holder,Holders & Stands
387,magic drawing slate circus parade  ,Other/Unknown
388,Christmas Hanging Heart With Bell,Decorative Items
389,cake stand victorian filigree med,Holders & Stands
390,Paisley Pattern  Stickers,Other/Unknown
391,FLOWERS  STICKERS,Decorative Items
392,black love bird candle,Candles
393,party time pencil erasers,Other/Unknown
394,DISCO BALL CHRISTMAS DECORATION,Decorative Items
395,PINK B'FLY C/COVER W BOBBLES,Other/Unknown
396,PINK UNION JACK  LUGGAGE TAG,Other/Unknown
397,6 Ribbons Elegant Christmas ,Other/Unknown
398,AGED GLASS SILVER T-LIGHT HOLDER,Holders & Stands
399,Boom Box Speaker Girls,Bags & Boxes
400,6 RIBBONS SHIMMERING PINKS ,Other/Unknown
401, set 2 tea towels i love london ,Other/Unknown
402,JUMBO BAG OWLS,Bags & Boxes
403,OWL DOORSTOP,Other/Unknown
404,5 strand glass necklace crystal,Jewellery
405,Large Popcorn Holder ,Holders & Stands
406,painted metal star with holly bells,Decorative Items
407,PAINTED METAL HEART WITH HOLLY BELL,Decorative Items
408,ANGEL DECORATION STARS ON DRESS,Decorative Items
409,Small Popcorn Holder,Holders & Stands
410,JUMBO BAG STRAWBERRY,Bags & Boxes
411,STRAWBERRY SHOPPER BAG,Bags & Boxes
412,Strawberry Charlotte Bag,Bags & Boxes
413, SET 2 TEA TOWELS I LOVE LONDON ,Other/Unknown
414,Pack Of 12 Red Retrospot Tissues ,Other/Unknown
415,lunch bag cars blue,Bags & Boxes
416,LUNCH BAG SPACEBOY DESIGN ,Bags & Boxes
417,ROUND SNACK BOXES SET OF4 WOODLAND ,Bags & Boxes
418,LUNCH BAG SUKI  DESIGN ,Bags & Boxes
419,lunch bag  black skull.,Bags & Boxes
420,round snack boxes set of 4 fruits ,Bags & Boxes
421,Round Snack Boxes Set Of 4 Skulls,Bags & Boxes
422,dolly girl lunch box,Bags & Boxes
423,SPACEBOY LUNCH BOX ,Bags & Boxes
424,Green Polkadot Plate ,Other/Unknown
425,BLUE POLKADOT PLATE ,Other/Unknown
426,RED RETROSPOT PLATE ,Other/Unknown
427,Pink  Polkadot Plate ,Other/Unknown
428,round snack boxes set of 4 skulls,Bags & Boxes
429,feltcraft doll molly,Other/Unknown
430,FELTCRAFT CHRISTMAS FAIRY,Other/Unknown
431,Set Of 3 Notebooks In Parcel,Books & Stationery
432,red retrospot tape,Other/Unknown
433,Cosy Slipper Shoes Small  Red ,Other/Unknown
434,6 Ribbons Rustic Charm,Other/Unknown
435,12 daisy pegs in wood box,Bags & Boxes
436,HOT WATER BOTTLE BABUSHKA ,Drinkware
437,feltcraft christmas fairy,Other/Unknown
438,feltcraft princess charlotte doll,Other/Unknown
439,6 ribbons rustic charm,Other/Unknown
440,cosy slipper shoes small  red ,Other/Unknown
441,5 hook hanger red magic toadstool,Storage & Organization
442,Christmas Craft Tree Top Angel,Other/Unknown
443,christmas craft little friends,Other/Unknown
444,5 Hook Hanger Red Magic Toadstool,Storage & Organization
445,6 RIBBONS RUSTIC CHARM,Other/Unknown
446,Cosy Slipper Shoes Small Green,Other/Unknown
447,feltcraft doll rosie,Other/Unknown
448,FELTCRAFT DOLL MOLLY,Other/Unknown
449,feltcraft doll emily,Other/Unknown
450,Feltcraft Princess Olivia Doll,Other/Unknown
451,rex cash+carry jumbo shopper,Other/Unknown
452,Feltcraft Cushion Owl,Other/Unknown
453,Christmas Craft Little Friends,Other/Unknown
454,FELTCRAFT CUSHION RABBIT,Other/Unknown
455,feltcraft cushion butterfly,Other/Unknown
456,12 Daisy Pegs In Wood Box,Bags & Boxes
457,Tote Bag I Love London,Bags & Boxes
458,FOLDING UMBRELLA PINKWHITE POLKADOT,Other/Unknown
459,FOLDING UMBRELLA CREAM POLKADOT,Other/Unknown
460,FOLDING UMBRELLA WHITE/RED POLKADOT,Other/Unknown
461,Set 10 Lights Night Owl,Lighting
462, Set 2 Tea Towels I Love London ,Other/Unknown
463,Folding Umbrella Red/White Polkadot,Other/Unknown
464,s/4 valentine decoupage heart box,Bags & Boxes
465,FOLDING UMBRELLA RED/WHITE POLKADOT,Other/Unknown
466,SOLDIERS EGG CUP ,Drinkware
467,S/4 Valentine Decoupage Heart Box,Bags & Boxes
468,RED RETROSPOT MINI CASES,Other/Unknown
469,60 cake cases vintage christmas,Vintage Items
470,RIBBON REEL CHRISTMAS SOCK BAUBLE,Other/Unknown
471,RIBBON REEL SNOWY VILLAGE,Other/Unknown
472,Ribbon Reel Making Snowmen ,Other/Unknown
473,set of 20 vintage christmas napkins,Vintage Items
474,Turquoise Christmas Tree ,Other/Unknown
475,Red Star Card Holder,Holders & Stands
476,WICKER WREATH SMALL,Other/Unknown
477,heart of wicker large,Decorative Items
478,Advent Calendar Gingham Sack,Other/Unknown
479,Feltcraft Butterfly Hearts,Decorative Items
480,Party Cone Christmas Decoration ,Decorative Items
481,VINTAGE HEADS AND TAILS CARD GAME ,Gifts & Cards
482,wicker star ,Decorative Items
483,VINTAGE SNAP CARDS,Gifts & Cards
484,feltcraft 6 flower friends,Decorative Items
485,bird decoration red retrospot,Decorative Items
486,CHRISTMAS GINGHAM TREE,Other/Unknown
487,CHRISTMAS GINGHAM STAR,Decorative Items
488,christmas gingham heart,Decorative Items
489,Pack Of 12 Pink Polkadot Tissues,Other/Unknown
490,FELTCRAFT PRINCESS LOLA DOLL,Other/Unknown
491,PACK OF 12 LONDON TISSUES ,Other/Unknown
492,Purple Drawerknob Acrylic Edwardian,Other/Unknown
493,Children'S Apron Dolly Girl ,Other/Unknown
494,childrens apron spaceboy design,Other/Unknown
495,christmas lights 10 santas ,Lighting
496,pack of 60 mushroom cake cases,Other/Unknown
497,60 cake cases dolly girl design,Other/Unknown
498,hand warmer babushka design,Other/Unknown
499,hand warmer bird design,Other/Unknown
500,SET 12 RETRO WHITE CHALK STICKS,Other/Unknown
501,FELTCRAFT HAIRBAND RED AND BLUE,Other/Unknown
502,feltcraft hairband pink and purple,Other/Unknown
503,Feltcraft Hairbands Pink And White ,Other/Unknown
504,tv dinner tray dolly girl,Other/Unknown
505,plasters in tin vintage paisley ,Vintage Items
506,plasters in tin spaceboy,Other/Unknown
507,Plasters In Tin Woodland Animals,Other/Unknown
508,MAGIC DRAWING SLATE SPACEBOY ,Other/Unknown
509,MAGIC DRAWING SLATE GO TO THE FAIR ,Other/Unknown
510,Magic Drawing Slate Dolly Girl ,Other/Unknown
511,charlie + lola red hot water bottle,Drinkware
512,URBAN BLACK RIBBONS ,Other/Unknown
513,Feltcraft Princess Charlotte Doll,Other/Unknown
514,Set Of 6 T-Lights Toadstools,Lighting
515,Rotating Leaves T-Light Holder,Holders & Stands
516,cupcake lace paper set 6,Drinkware
517,Family Photo Frame Cornice,Other/Unknown
518,Triple Photo Frame Cornice ,Other/Unknown
519,WOODEN BOX OF DOMINOES,Bags & Boxes
520,traditional wooden catch cup game ,Drinkware
521,S/6 Wooden Skittles In Cotton Bag,Bags & Boxes
522,RED METAL BEACH SPADE ,Other/Unknown
523,boys vintage tin seaside bucket,Vintage Items
524,girls vintage tin seaside bucket,Vintage Items
525,Grey Heart Hot Water Bottle,Drinkware
526,Scottie Dog Hot Water Bottle,Drinkware
527,kings choice tea caddy ,Other/Unknown
528,Kings Choice Biscuit Tin,Other/Unknown
529,METAL SIGN EMPIRE TEA,Other/Unknown
530,set of 6 soldier skittles,Other/Unknown
531,Fawn Blue Hot Water Bottle,Drinkware
532,Hot Water Bottle Babushka ,Drinkware
533,WHITE SKULL HOT WATER BOTTLE ,Drinkware
534,GREY HEART HOT WATER BOTTLE,Drinkware
535,Pack Of 6 Birdy Gift Tags,Gifts & Cards
536,Piggy Bank Retrospot ,Other/Unknown
537,ceramic strawberry money box,Bags & Boxes
538,ceramic strawberry cake money bank,Other/Unknown
539,ceramic heart fairy cake money bank,Decorative Items
540,Ceramic Pirate Chest Money Bank,Other/Unknown
541,doorstop retrospot heart,Decorative Items
542,RETROSPOT BABUSHKA DOORSTOP,Other/Unknown
543,silk purse babushka red,Other/Unknown
544,SWEETHEART WIRE WALL TIDY,Decorative Items
545,JAM MAKING SET PRINTED,Other/Unknown
546,RED RETROSPOT OVEN GLOVE ,Other/Unknown
547,CREAM HEART CARD HOLDER,Holders & Stands
548,Namaste Swagat Incense,Other/Unknown
549,Ceramic Strawberry Design Mug,Drinkware
550,Classical Rose Small Vase,Other/Unknown
551,HYACINTH BULB T-LIGHT CANDLES,Lighting
552,Christmas Craft White Fairy ,Other/Unknown
553,cosy hour cigar box matches ,Bags & Boxes
554,RED TEA TOWEL CLASSIC DESIGN,Other/Unknown
555,HEART FILIGREE DOVE  SMALL,Decorative Items
556,RETROSPOT CHILDRENS APRON,Other/Unknown
557,Colouring Pencils Brown Tube,Other/Unknown
558,4 IVORY DINNER CANDLES SILVER FLOCK,Candles
559,heart filigree dove  small,Decorative Items
560,ZINC METAL HEART DECORATION,Decorative Items
561,GREEN FERN NOTEBOOK,Books & Stationery
562,BLUE PAISLEY NOTEBOOK,Books & Stationery
563,Chrysanthemum Notebook,Books & Stationery
564,Large Chinese Style Scissor,Other/Unknown
565,Small Chinese Style Scissor,Other/Unknown
566,s/6 wooden skittles in cotton bag,Bags & Boxes
567,4 TRADITIONAL SPINNING TOPS,Other/Unknown
568,rotating silver angels t-light hldr,Lighting
569,Retrospot Childrens Apron,Other/Unknown
570,hanging glass etched tealight,Lighting
571,Blue New Baroque Candlestick Candle,Candles
572,COOKING SET RETROSPOT,Other/Unknown
