product_id,product_name,category
7774,cream delphinium artificial flower,Decorative Items
7775,georgian trinket box,Bags & Boxes
7776,SINGLE ANTIQUE ROSE HOOK IVORY,Storage & Organization
7777,Miniature Antique Rose Hook Ivory,Storage & Organization
7778,Flowers Chandelier T-Light Holder,Holders & Stands
7779,zinc t-light holder stars small,Holders & Stands
7780,Triple Hook Antique Ivory Rose,Storage & Organization
7781,Ivory Wire Kitchen Organiser,Other/Unknown
7782,miniature antique rose hook ivory,Storage & Organization
7783,Single Antique Rose Hook Ivory,Storage & Organization
7784,Ivory Wire Sweetheart Letter Tray,Decorative Items
7785,TRIPLE WIRE HOOK PINK HEART,Storage & Organization
7786,SINGLE WIRE HOOK PINK HEART,Storage & Organization
7787,SINGLE WIRE HOOK IVORY HEART,Storage & Organization
7788,Ivory Sweetheart Soap Dish,Decorative Items
7789,triple wire hook ivory heart,Storage & Organization
7790,LARGE ZINC HEART WALL ORGANISER,Decorative Items
7791,ivory sweetheart wire letter rack ,Decorative Items
7792,ivory wire kitchen organiser,Other/Unknown
7793,zinc t-light holder star large,Holders & Stands
7794,TUMBLER BAROQUE,Other/Unknown
7795,Retro Longboard Ironing Board Cover,Other/Unknown
7796,Icon Placemat Pop Art Elvis,Other/Unknown
7797,Elvis Wallhanging / Curtain,Other/Unknown
7798,Gold Aperitif Glass,Other/Unknown
7799,Grass Hopper Wooden Wall Clock ,Clocks
7800,BLUE CAT BISCUIT BARREL PINK HEART,Decorative Items
7801,painted sea shell metal windchime,Other/Unknown
7802,small ivory heart wall organiser,Decorative Items
7803,16 piece cutlery set pantry design,Other/Unknown
7804,Blue Savannah Picnic Hamper For 2,Other/Unknown
7805,ALUMINIUM STAMPED HEART,Decorative Items
7806,set of 4 napkin charms leaves   ,Other/Unknown
7807,PINK BUTTERFLY CUSHION COVER,Other/Unknown
7808,ZINC T-LIGHT HOLDER STARS SMALL,Holders & Stands
7809,ivory wire sweetheart letter tray,Decorative Items
7810,Zinc Wire Sweetheart Letter Tray,Decorative Items
7811,VINTAGE EMBOSSED HEART,Decorative Items
7812,Painted Lightbulb Rainbow Design,Lighting
7813,Zinc T-Light Holder Star Large,Holders & Stands
7814,IVORY SWEETHEART WIRE LETTER RACK ,Decorative Items
7815,single antique rose hook ivory,Storage & Organization
7816,Single Wire Hook Ivory Heart,Storage & Organization
7817,Lilac Votive Candle,Candles
7818,IVORY WIRE SWEETHEART LETTER TRAY,Decorative Items
7819,TEATIME GEL PENS ASST,Other/Unknown
7820,Large Skull Windmill,Other/Unknown
7821,ivory sweetheart soap dish,Decorative Items
7822,single wire hook ivory heart,Storage & Organization
7823,pale pink/amethyst stone necklace,Jewellery
7824,orange/wht/fuschia stones necklace,Jewellery
7825,white/pink mini crystals necklace,Jewellery
7826,COTE D'AZURE NECKLACE,Jewellery
7827,White  Rosebud Pearl Bracelet,Jewellery
7828,pink rosebud & pearl necklace,Jewellery
7829,WHITE ROSEBUD & PEARL NECKLACE,Jewellery
7830,St Tropez Necklace,Jewellery
7831,riviera necklace,Jewellery
7832,Cracked Glaze Necklace Red,Jewellery
7833,PACK 20 DOLLY PEGS,Other/Unknown
7834,Silver Disco Handbag,Bags & Boxes
7835,pink butterfly cushion cover,Other/Unknown
7836,SET/6 POSIES PAPER PLATES,Other/Unknown
7837,garden path notebook ,Books & Stationery
7838,aluminium stamped heart,Decorative Items
7839,steel sweetheart round table cream,Decorative Items
7840,HEART T-LIGHT HOLDER ,Holders & Stands
7841,Edwardian Photo Frame,Other/Unknown
7842,assorted mini madras notebook,Books & Stationery
7843,maxwell 2 tone blue 60 page photo a,Other/Unknown
7844,mistletoe heart wreath cream,Decorative Items
7845,Hanging Engraved Metal Heart,Decorative Items
7846,HANGING ENGRAVED METAL HEART,Decorative Items
7847,Zinc T-Light Holder Stars Small,Holders & Stands
7848,POTTING SHED CANDLE CITRONELLA,Candles
7849,BLUE TABLE RUN FLOWER,Decorative Items
7850,blue stripes shoulder bag,Bags & Boxes
7851,BLUE CHECK BAG W HANDLE 34X20CM,Bags & Boxes
7852,Purple Boudicca Large Bracelet,Jewellery
7853,origami lavender incense/candl set ,Other/Unknown
7854,ORIGAMI VANILLA INCENSE/CANDLE SET ,Candles
7855,lilac votive candle,Candles
7856,Scented Velvet Lounge Candle ,Candles
7857,Laser Cut Multi Strand Necklace,Jewellery
7858,REGENCY SUGAR TONGS,Other/Unknown
7859,Doormat Keep Calm And Come In,Other/Unknown
7860,doormat vintage leaves design ,Vintage Items
7861,Green Enamel Flower Ring,Decorative Items
7862,red enamel flower ring,Decorative Items
7863,Black Enamel Flower Ring,Decorative Items
7864,Purple Enamel Flower Ring,Decorative Items
7865,doormat keep calm and come in,Other/Unknown
7866,RETRO PINK BALL ASHTRAY ,Other/Unknown
7867,DOORMAT KEEP CALM AND COME IN,Other/Unknown
7868,A4 Wall Tidy Blue Office,Other/Unknown
7869,Cd Wall Tidy Blue Office,Other/Unknown
7870,ASSORTED FARMYARD ANIMALS IN BUCKET,Other/Unknown
7871,medium chinese style scissor,Other/Unknown
7872,pink monte carlo handbag,Bags & Boxes
7873,regency tea strainer,Other/Unknown
7874,Large Ivory Heart Wall Organiser,Decorative Items
7875,Beach Hut Shelf W 3 Drawers,Other/Unknown
7876,"Greeting Card, Sticky Gordon",Gifts & Cards
7877,BOHEMIAN COLLAGE STATIONERY SET,Other/Unknown
7878,SQUARE METAL CANDLEHOLDER BASE,Holders & Stands
7879,Small Zinc/Glass Candleholder,Holders & Stands
7880,STANDING FAIRY POLE SUPPORT ,Holders & Stands
7881,candy heart hanging decoration,Decorative Items
7882,Beaded Crystal Heart Blue On Stick,Decorative Items
7883,Triple Wire Hook Ivory Heart,Storage & Organization
7884,Single Wire Hook Pink Heart,Storage & Organization
7885,MINIATURE ANTIQUE ROSE HOOK IVORY,Storage & Organization
7886,vintage embossed heart,Decorative Items
7887,gold flower cushion cover ,Decorative Items
7888,Set Of 10 Lanterns Fairy Light Star,Lighting
7889,PAPER LANTERN 7 POINT SNOW STAR,Lighting
7890,Paper Lantern 9 Point Snow Star,Lighting
7891,paper lantern 9 point snow star ,Lighting
7892,Cinderella Chandelier ,Other/Unknown
7893,regency sugar tongs,Other/Unknown
7894,PINK HAWAIIAN PICNIC HAMPER FOR 2,Other/Unknown
7895,wrap carousel,Other/Unknown
7896,SMALL TALL CAMPHOR WOOD TOADSTOOL,Other/Unknown
7897,ANTIQUE ALL GLASS CANDLESTICK,Candles
7898,BLING KEY RING STAND,Holders & Stands
7899,large zinc heart wall organiser,Decorative Items
7900,GOLD FLOWER CUSHION COVER ,Decorative Items
7901,DOORMAT VINTAGE LEAVES DESIGN ,Vintage Items
7902,Mirrored Wall Art Poppies,Other/Unknown
7903,MISTLETOE HEART WREATH GREEN,Decorative Items
7904,Blue Table Run Flower,Decorative Items
7905,Psychedelic Tile Coaster,Other/Unknown
7906,PSYCHEDELIC TILE HOOK,Storage & Organization
7907,white 3 frame birds and tree ,Other/Unknown
7908,WRAP FOLK ART,Other/Unknown
7909,french lattice cushion cover ,Other/Unknown
7910,WRAP SUMMER ROSE DESIGN,Other/Unknown
7911,pink flower fabric pony,Decorative Items
7912,Blue Chenille Shaggy Cushion Cover ,Other/Unknown
7913,french paisley cushion cover,Other/Unknown
7914,FRENCH FLORAL CUSHION COVER ,Other/Unknown
7915,FRENCH LATTICE CUSHION COVER ,Other/Unknown
7916,Regency Tea Spoon,Other/Unknown
7917,Regency Cake Fork,Other/Unknown
7918,REGENCY CAKE SLICE,Other/Unknown
7919,PURPLE ENAMEL FLOWER RING,Decorative Items
7920,RED ENAMEL FLOWER RING,Decorative Items
7921,green enamel flower ring,Decorative Items
7922,SMALL DECO JEWELLERY STAND,Holders & Stands
7923,Antique Ivory Wire Bowl Small,Vintage Items
7924,Parlour Ceramic Wall Hook,Storage & Organization
7925,blue & white breakfast tray,Other/Unknown
7926,miniture antique rose hook ivory,Storage & Organization
7927,ZINC T-LIGHT HOLDER STAR LARGE,Holders & Stands
7928,Black Christmas Tree 60Cm,Other/Unknown
7929,pink flock photo frame ,Other/Unknown
7930,blue flower des purse,Decorative Items
7931,VINTAGE KITCHEN PRINT VEGETABLES,Vintage Items
7932,Retrospot Candle  Large,Candles
7933,"RETRO PILL BOX KEY CHAIN,THE KING",Bags & Boxes
7934,Hand Towel Pink Flower And Daisy,Decorative Items
7935,purple bertie glass bead bag charm,Bags & Boxes
7936,s/4 black mini rose candle in bowl,Candles
7937,MIRRORED WALL ART GENTS,Other/Unknown
7938,regency cake slice,Other/Unknown
7939,Doormat Vintage Leaves Design ,Vintage Items
7940,PAPER LANTERN 9 POINT SNOW STAR,Lighting
7941,beach hut mirror,Other/Unknown
7942,s/2 beach hut treasure chests,Other/Unknown
7943,ZINC WIRE KITCHEN ORGANISER,Other/Unknown
7944,small hanging glass+zinc lantern,Lighting
7945,FOOD COVER WITH BEADS SET 2 ,Other/Unknown
7946,SPOTTY BUNTING,Other/Unknown
7947,REGENCY CAKE FORK,Other/Unknown
7948,Regency Tea Strainer,Other/Unknown
7949,Regency Cake Slice,Other/Unknown
7950,edwardian heart photo frame,Decorative Items
7951,Food Cover With Beads Set 2 ,Other/Unknown
7952,spotty bunting,Other/Unknown
7953,EDWARDIAN PHOTO FRAME,Other/Unknown
7954,BLOND DOLL DOORSTOP,Other/Unknown
7955,Folk Art Metal Star T-Light Holder,Holders & Stands
7956,BEADED CHANDELIER T-LIGHT HOLDER,Holders & Stands
7957,ANTIQUE IVORY WIRE BOWL SMALL,Vintage Items
7958,Small Deco Jewellery Stand,Holders & Stands
7959,mistletoe heart wreath green,Decorative Items
7960,Daisy Folkart Heart Decoration,Decorative Items
7961,ZINC SWEETHEART SOAP DISH,Decorative Items
7962,SET OF 12 ROSE BOTANICAL T-LIGHTS,Lighting
7963,teatime gel pens asst,Other/Unknown
7964,Silver Aperitif Glass,Other/Unknown
7965,crystal stud earrings clear display,Other/Unknown
7966,crystal stud earrings assorted col ,Other/Unknown
7967,ASSORTED COLOUR METAL CAT ,Other/Unknown
7968,french floral cushion cover ,Other/Unknown
7969,paper lantern 9 point snow star,Lighting
7970,Paper Lantern 9 Point Holly Star 40,Lighting
7971,Paper Lantern 5 Point Star Moon 30,Lighting
7972,Paper Lantern 7 Point Snow Star,Lighting
7973,PAPER LANTERN 6 POINT SNOW STAR,Lighting
7974,Regency Sugar Tongs,Other/Unknown
7975,Spotty Bunting,Other/Unknown
7976,Pink And White Christmas Tree 120Cm,Other/Unknown
7977,EDWARDIAN HEART PHOTO FRAME,Decorative Items
7978,"bunting , spotty ",Other/Unknown
7979,pink fly swat,Other/Unknown
7980,PIG MUG IN TWO COLOUR DESIGNS,Drinkware
7981,food cover with beads set 2 ,Other/Unknown
7982,MISTLETOE HEART WREATH CREAM,Decorative Items
7983,BOTANICAL LILY GIFT WRAP,Gifts & Cards
7984,POLYESTER FILLER PAD 60X40CM,Other/Unknown
7985,Green Cat Floral Cushion Cover ,Other/Unknown
7986,KIDS CUTLERY SPACEBOY ,Other/Unknown
7987,KIDS CUTLERY DOLLY GIRL ,Other/Unknown
7988,ass colour glowing tiaras,Other/Unknown
7989,Blue Disco Handbag,Bags & Boxes
7990,tall rococo candle holder,Holders & Stands
7991,paper lantern 7 point snow star,Lighting
7992,16 Piece Cutlery Set Pantry Design,Other/Unknown
7993,PINK PILLAR CANDLE SILVER FLOCK,Candles
7994,Floral Bathroom Set,Other/Unknown
7995,4 LAVENDER BOTANICAL DINNER CANDLES,Candles
7996,GOLDIE LOOKING MIRROR,Other/Unknown
7997,French Lattice Cushion Cover ,Other/Unknown
7998,lunch bag doiley pattern ,Bags & Boxes
7999,Jumbo Bag Pears,Bags & Boxes
8000,Lunch Bag Doiley Pattern ,Bags & Boxes
8001,jumbo bag doiley patterns,Bags & Boxes
8002,Kids Cutlery Spaceboy ,Other/Unknown
8003,LUNCH BAG DOILEY PATTERN ,Bags & Boxes
8004,jumbo bag vintage leaf,Bags & Boxes
8005,hanging engraved metal heart,Decorative Items
8006,paper lantern 9 point holly star l,Lighting
8007,Paper Lantern 9 Point Deluxe Star,Lighting
8008,Paper Lantern 5 Point Sequin Star,Lighting
8009,Paper Lantern 9 Point Holly Star S,Lighting
8010,PAPER LANTERN 5 POINT SEQUIN STAR,Lighting
8011,JUMBO BAG DOILEY PATTERNS,Bags & Boxes
8012,JUMBO BAG VINTAGE LEAF,Bags & Boxes
8013,Paper Lantern 9 Point Snow Star ,Lighting
8014,paper lantern 9 point holly star 23,Lighting
8015,paper lantern 9 point holly star 40,Lighting
8016,Paper Lantern 5 Point Studded Star,Lighting
8017,Jumbo Bag Vintage Leaf,Bags & Boxes
8018,hardman mug 3 assorted,Drinkware
8019,"charlie+lola""extremely busy"" sign",Other/Unknown
8020,60 GOLD AND SILVER FAIRY CAKE CASES,Other/Unknown
8021,JUMBO BAG PEARS,Bags & Boxes
8022,Jumbo Bag Doiley Patterns,Bags & Boxes
8023,teatime push down rubber,Other/Unknown
8024,PAPER LANTERN 9 POINT HOLLY STAR L,Lighting
8025,PAPER LANTERN 9 POINT HOLLY STAR S,Lighting
8026,CRYSTAL HOOP EARRING FLORAL LEAF,Other/Unknown
8027,charlie+lola red hot water bottle ,Drinkware
8028,OYSTER TRINKET BOX,Bags & Boxes
8029,"Food Cover With Beads , Set 2 Sizes",Other/Unknown
8030,rasta in bath w spliff ashtray,Other/Unknown
8031,"Flower Glass Garld Neckl36""Amethyst",Decorative Items
8032,Flower Garland Necklace Red,Decorative Items
8033,ivory shell heart earrings,Decorative Items
8034,FILIGREE DIAMANTE EARRINGS,Other/Unknown
8035,turq stone/crystal earrings,Other/Unknown
8036,Jade Drop Earrings W Filigree,Other/Unknown
8037,lily brooch amethyst colour,Other/Unknown
8038,"ACRYLIC JEWEL SNOWFLAKE, PINK",Other/Unknown
8039,"flower glass garland neckl.36""blue",Decorative Items
8040,Green Sweetheart Bracelet,Decorative Items
8041,silver disco handbag,Bags & Boxes
8042,VINTAGE BEAD PINK PURSE ,Vintage Items
8043,condiment tray 4 bowls and 4 spoons,Other/Unknown
8044,WRAP BAD HAIR DAY,Other/Unknown
8045,Folding Butterfly Mirror Ivory ,Other/Unknown
8046,FOLDING BUTTERFLY MIRROR HOT PINK ,Other/Unknown
8047,Bundle Of 3 School Exercise Books  ,Books & Stationery
8048,HEART BEADED TRELLIS DECORATION,Decorative Items
8049,bundle of 3 retro note books,Books & Stationery
8050,GREEN GOOSE FEATHER TREE 60CM,Other/Unknown
8051,pink goose feather tree 60cm,Other/Unknown
8052,White Goose Feather Tree 60Cm ,Other/Unknown
8053,bundle of 3 retro exercise books,Books & Stationery
8054,regency milk jug pink ,Other/Unknown
8055,Regency Sugar Bowl Green,Other/Unknown
8056,regency teapot roses ,Other/Unknown
8057,Regency Tea Plate Pink,Other/Unknown
8058,REGENCY TEA PLATE GREEN ,Other/Unknown
8059,REGENCY TEA PLATE ROSES ,Other/Unknown
8060,Regency Tea Plate Green ,Other/Unknown
8061,regency tea plate pink,Other/Unknown
8062,REGENCY SUGAR BOWL GREEN,Other/Unknown
8063,regency tea plate green ,Other/Unknown
8064,regency tea plate roses ,Other/Unknown
8065,jumbo bag pears,Bags & Boxes
8066,REGENCY TEA STRAINER,Other/Unknown
8067,Regency Tea Plate Roses ,Other/Unknown
8068,REGENCY TEA PLATE PINK,Other/Unknown
8069,REGENCY TEAPOT ROSES ,Other/Unknown
8070,Green Metal Box Army Supplies,Bags & Boxes
8071,rose du sud washbag ,Bags & Boxes
8072,ROSE DU SUD COSMETICS BAG,Bags & Boxes
8073,rabbit night light,Lighting
8074,Folding Butterfly Mirror Red  ,Other/Unknown
8075,pink & white breakfast tray,Other/Unknown
8076,Regency Milk Jug Pink ,Other/Unknown
8077,Marie Antoinette Trinket Box Silver,Bags & Boxes
8078,mirror mosaic candle plate,Candles
8079,parisienne jewellery drawer ,Jewellery
8080,REGENCY TEA SPOON,Other/Unknown
8081,regency cake fork,Other/Unknown
8082,regency sugar bowl green,Other/Unknown
8083,Regency Teapot Roses ,Other/Unknown
8084,Petit Tray Chic,Other/Unknown
8085,zinc herb garden container,Other/Unknown
8086,Le Grand Tray Chic Set,Other/Unknown
8087,Set Of 10 Led Dolly Lights,Lighting
8088,GREEN METAL BOX ARMY SUPPLIES,Bags & Boxes
8089,Red Metal Box Top Secret,Bags & Boxes
8090,SET OF 10 LED DOLLY LIGHTS,Lighting
8091,RABBIT NIGHT LIGHT,Lighting
8092,RED METAL BOX TOP SECRET,Bags & Boxes
8093,green metal box top secret,Bags & Boxes
8094,PARISIENNE KEY CABINET ,Other/Unknown
8095,PETIT TRAY CHIC,Other/Unknown
8096,BUNDLE OF 3 RETRO EXERCISE BOOKS,Books & Stationery
8097,BUNDLE OF 3 ALPHABET EXERCISE BOOKS,Books & Stationery
8098,Silver Bells Table Decoration,Decorative Items
8099,Silver Hearts Table Decoration,Decorative Items
8100,Vintage Engraved Heart,Decorative Items
8101,set 6 paper table lantern hearts ,Lighting
8102,paper lantern 9 point deluxe star,Lighting
8103,Pink Butterfly Cushion Cover,Other/Unknown
8104,flowers handbag blue and orange,Bags & Boxes
8105,Small Parisienne Heart Photo Frame ,Decorative Items
8106,parisienne key cabinet ,Other/Unknown
8107,FOLDING MIRROR HOT PINK ,Other/Unknown
8108,"Bunting , Spotty ",Other/Unknown
8109,led tea lights,Lighting
8110,Bell Heart Decoration,Decorative Items
8111,vintage engraved heart,Decorative Items
8112,aluminium heart,Decorative Items
8113,crystal chandelier t-light holder,Holders & Stands
8114,gemstone chandelier t-light holder,Holders & Stands
8115,paper lantern 5 point studded star,Lighting
8116,PAPER LANTERN 9 POINT DELUXE STAR,Lighting
8117,PAPER LANTERN 9 POINT HOLLY STAR 40,Lighting
8118,PAPER LANTERN 5 POINT STAR MOON 30,Lighting
8119,paper lantern 6 point snow star,Lighting
8120,Rabbit Night Light,Lighting
8121,BUNDLE OF 3 RETRO NOTE BOOKS,Books & Stationery
8122,parisienne curio cabinet,Other/Unknown
8123,LED TEA LIGHTS,Lighting
8124,folding butterfly mirror hot pink ,Other/Unknown
8125,FOLDING BUTTERFLY MIRROR IVORY ,Other/Unknown
8126,BUNDLE OF 3 SCHOOL EXERCISE BOOKS  ,Books & Stationery
8127,set of 10 led dolly lights,Lighting
8128,Bundle Of 3 Alphabet Exercise Books,Books & Stationery
8129,Green Metal Box Top Secret,Bags & Boxes
8130,small ceramic top storage jar ,Other/Unknown
8131,Ivory Pantry Hanging Lamp ,Other/Unknown
8132,Silver Bracelet W Pastel Flower,Decorative Items
8133,white vint art deco crystal necklac,Other/Unknown
8134,Black Vint Art Dec Crystal Necklace,Jewellery
8135,Maxwell 2 Tone Blue 60 Page Photo A,Other/Unknown
8136,Tall Rococo Candle Holder,Holders & Stands
8137,Led Tea Lights,Lighting
8138,classic sugar dispenser,Other/Unknown
8139,PARISIENNE JEWELLERY DRAWER ,Jewellery
8140,SMALL PARISIENNE HEART PHOTO FRAME ,Decorative Items
8141,STRAWBERRIES  DESIGN FLANNEL ,Other/Unknown
8142,LARGE JEWELLERY STAND,Holders & Stands
8143,small jewellery stand,Holders & Stands
8144,silver stars table decoration,Decorative Items
8145,silver hearts table decoration,Decorative Items
8146,SET 6 PAPER TABLE LANTERN HEARTS ,Lighting
8147,large ceramic top storage jar,Other/Unknown
8148,medium ceramic top storage jar,Other/Unknown
8149,REGENCY MILK JUG PINK ,Other/Unknown
8150,glass bon bon jar,Other/Unknown
8151,white wire plant pot holder,Holders & Stands
8152,CLASSIC GLASS COOKIE JAR,Other/Unknown
8153,Medium Ceramic Top Storage Jar,Other/Unknown
8154,fire polished glass bracelet green,Jewellery
8155,fire polished glass bracelet montan,Jewellery
8156,fire polished glass bracelet red,Jewellery
8157,LARGE CERAMIC TOP STORAGE JAR,Other/Unknown
8158,Bundle Of 3 Retro Note Books,Books & Stationery
8159,CLASSIC CAFE SUGAR DISPENSER,Other/Unknown
8160,"GREETING CARD,SQUARE, DOUGHNUTS",Gifts & Cards
8161,Beach Hut Mirror,Other/Unknown
8162,green metal box army supplies,Bags & Boxes
8163,Blue Check Bag W Handle 34X20Cm,Bags & Boxes
8164,toadstool bedside light ,Lighting
8165,Jingle Bell Heart Decoration,Decorative Items
8166,classic glass cookie jar,Other/Unknown
8167,MIRROR MOSAIC T-LIGHT HOLDER ROUND,Holders & Stands
8168,ZINC HERB GARDEN CONTAINER,Other/Unknown
8169,marie antoinette trinket box silver,Bags & Boxes
8170,Georgian Trinket Box,Bags & Boxes
8171,red metal box top secret,Bags & Boxes
8172,bundle of 3 school exercise books  ,Books & Stationery
8173,Classic Cafe Sugar Dispenser,Other/Unknown
8174,Small Ceramic Top Storage Jar ,Other/Unknown
8175,Large Ceramic Top Storage Jar,Other/Unknown
8176,bundle of 3 alphabet exercise books,Books & Stationery
8177,parisienne sewing box,Bags & Boxes
8178,JINGLE BELL HEART DECORATION,Decorative Items
8179,ZINC HEARTS PLANT POT HOLDER,Holders & Stands
8180,white hearts wire plant pot holder,Holders & Stands
8181,WHITE HEARTS WIRE PLANT POT HOLDER,Holders & Stands
8182,Zinc Hearts Plant Pot Holder,Holders & Stands
8183,Candy Spot Hand Bag,Bags & Boxes
8184,Parisienne Curio Cabinet,Other/Unknown
8185,Toadstool Bedside Light ,Lighting
8186,SILVER STARS TABLE DECORATION,Decorative Items
8187,YELLOW/BLUE RETRO RADIO,Other/Unknown
8188,blue check bag w handle 34x20cm,Bags & Boxes
8189,Zinc Herb Garden Container,Other/Unknown
8190,GLASS BON BON JAR,Other/Unknown
8191,Zinc  Heart T-Light Holder,Holders & Stands
8192,ZINC HEART FLOWER T-LIGHT HOLDER,Holders & Stands
8193,Metal Herb Gerden Container,Other/Unknown
8194,classic glass sweet jar,Other/Unknown
8195,Zinc Plant Pot Holder,Holders & Stands
8196,FOLDING MIRROR IVORY ,Other/Unknown
8197,FOLDING MIRROR RED  ,Other/Unknown
8198,kids cutlery dolly girl ,Other/Unknown
8199,Paper Lantern 6 Point Snow Star,Lighting
8200,PARISIENNE CURIO CABINET,Other/Unknown
8201,Classic Sugar Dispenser,Other/Unknown
8202,Double Ceramic Parlour Hook,Storage & Organization
8203,SMALL CERAMIC TOP STORAGE JAR ,Other/Unknown
8204,folding mirror ivory ,Other/Unknown
8205,"BUNTING , SPOTTY ",Other/Unknown
8206,small parisienne heart photo frame ,Decorative Items
8207,Parisienne Key Cabinet ,Other/Unknown
8208,Parisienne Jewellery Drawer ,Jewellery
8209,PARISIENNE SEWING BOX,Bags & Boxes
8210,SILVER HEARTS TABLE DECORATION,Decorative Items
8211,silver bells table decoration,Decorative Items
8212,antique ivory wire bowl small,Vintage Items
8213,"pearl & shell 42""neckl. ivory",Other/Unknown
8214,jingle bell heart decoration,Decorative Items
8215,edwardian photo frame,Other/Unknown
8216,Parisienne Sewing Box,Bags & Boxes
8217,PINK JEWELLED PHOTO FRAME ,Other/Unknown
8218,hanging heart with bell,Decorative Items
8219,Zinc Heart Flower T-Light Holder,Holders & Stands
8220,Set 6 Paper Table Lantern Hearts ,Lighting
8221,Gardeners Kneeling Pad Keep Calm ,Other/Unknown
8222,gardeners kneeling pad cup of tea ,Drinkware
8223,GARDENERS KNEELING PAD KEEP CALM ,Other/Unknown
8224,GARDENERS KNEELING PAD CUP OF TEA ,Drinkware
8225,Mistletoe Heart Wreath Cream,Decorative Items
8226,Mistletoe Heart Wreath Green,Decorative Items
8227,Gardeners Kneeling Pad Cup Of Tea ,Drinkware
8228,petit tray chic,Other/Unknown
8229,Glass Bon Bon Jar,Other/Unknown
8230,ORIGAMI SANDLEWOOD INCENSE+FLOWER,Decorative Items
8231,Mirror Mosaic T-Light Holder ,Holders & Stands
8232,KNEELING MAT HOUSEWORK  DESIGN,Other/Unknown
8233,Pocket Bag Blue Paisley Red Spot,Bags & Boxes
8234,ENGLISH ROSE SCENTED HANGING HEART,Decorative Items
8235,Vintage Glass T-Light Holder,Holders & Stands
8236,Bundle Of 3 Retro Exercise Books,Books & Stationery
8237,bell heart decoration,Decorative Items
8238,Silver Stars Table Decoration,Decorative Items
8239,CLASSIC GLASS SWEET JAR,Other/Unknown
8240,Set 6 Paper Table Lantern Stars ,Lighting
8241,set 6 paper table lantern stars ,Lighting
8242,zinc hearts plant pot holder,Holders & Stands
8243,CLASSIC SUGAR DISPENSER,Other/Unknown
8244,MINITURE ANTIQUE ROSE HOOK IVORY,Storage & Organization
8245,Large Antique White Photo Frame,Vintage Items
8246,gardeners kneeling pad keep calm ,Other/Unknown
8247,ANTIQUE SILVER BAUBLE LAMP  ,Vintage Items
8248,classic cafe sugar dispenser,Other/Unknown
8249,Fuschia Voile Pointy Shoe Dec,Other/Unknown
8250,DANISH ROSE BEDSIDE CABINET,Other/Unknown
8251,zinc  heart t-light holder,Holders & Stands
8252,zinc heart flower t-light holder,Holders & Stands
8253,French Carriage Lantern,Lighting
8254,large antique white photo frame,Vintage Items
8255,blue  tile hook,Storage & Organization
8256,ZINC  STAR T-LIGHT HOLDER ,Holders & Stands
8257,ZINC  HEART T-LIGHT HOLDER,Holders & Stands
8258,Classic Glass Cookie Jar,Other/Unknown
8259,folding butterfly mirror ivory ,Other/Unknown
8260,Folding Butterfly Mirror Hot Pink ,Other/Unknown
8261,FOLDING BUTTERFLY MIRROR RED  ,Other/Unknown
8262,paper lantern 5 point sequin star,Lighting
8263,BLACK ORANGE SQUEEZER,Other/Unknown
8264,WHITE SQUARE TABLE CLOCK,Clocks
8265,TOADSTOOL BEDSIDE LIGHT ,Lighting
8266,set/4 badges dogs,Other/Unknown
8267,regency tea spoon,Other/Unknown
8268,single wire hook pink heart,Storage & Organization
8269,small zinc heart wall organiser,Decorative Items
8270,Kneeling Mat Housework  Design,Other/Unknown
8271,Heart Beaded Trellis Decoration,Decorative Items
8272,french carriage lantern,Lighting
8273,Zinc Sweetheart Soap Dish,Decorative Items
8274,FLOWERS CHANDELIER T-LIGHT HOLDER,Holders & Stands
8275,space cadet red,Other/Unknown
8276,gold m.o.p orbit drop earrings,Other/Unknown
8277,LARGE ANTIQUE WHITE PHOTO FRAME,Vintage Items
8278,necklace+bracelet set blue hibiscus,Jewellery
8279,"letter ""y"" bling key ring",Keyrings
8280,"letter ""c"" bling key ring",Keyrings
8281,WRAP CAROUSEL,Other/Unknown
8282,FUNKY FLOWER PICNIC BAG FOR 4,Bags & Boxes
8283,SET OF 6 NATIVITY MAGNETS ,Other/Unknown
8284,SET 6 PAPER TABLE LANTERN STARS ,Lighting
8285,number tile cottage garden 7,Other/Unknown
8286,green/blue flower design big mug,Drinkware
8287,Dark Bird House Tree Decoration,Decorative Items
8288,SILVER T-LIGHT SETTING,Lighting
8289,SILVER GLASS T-LIGHT SET,Lighting
8290,Magazine Rack Gebra Assorted ,Other/Unknown
8291,marie antoinette trinket box gold,Bags & Boxes
8292,Set Of 12 Rose Botanical T-Lights,Lighting
8293,MULTICOLOUR POLKADOT PLATE,Other/Unknown
8294,Large Blue Provencal Ceramic Ball,Other/Unknown
8295,SMALL BLUE PROVENCAL CERAMIC BALL,Other/Unknown
8296,triple wire hook pink heart,Storage & Organization
8297,kneeling mat housework  design,Other/Unknown
8298,set 10 night owl lights,Lighting
8299,miseltoe heart wreath ,Decorative Items
8300,Heart Shaped Holly Wreath,Decorative Items
8301,miseltoe heart wreath white,Decorative Items
8302,LE GRAND TRAY CHIC SET,Other/Unknown
8303,BLUE DELPHINIUM ARTIFICIAL FLOWER,Decorative Items
8304,white candystuft artificial flower,Decorative Items
8305,IVORY CAFE HANGING LAMP ,Other/Unknown
8306,Blue Stones On Wire For Candle,Candles
8307,french paisley cushion cover ,Other/Unknown
8308,FRENCH PAISLEY CUSHION COVER,Other/Unknown
8309,cherry blossom table clock ,Clocks
8310,Zinc  Star T-Light Holder ,Holders & Stands
8311,SILVER BELLS TABLE DECORATION,Decorative Items
8312,RED PEONY CUSHION COVER ,Other/Unknown
8313,green peony cushion cover,Other/Unknown
8314,round white confetti in tube,Other/Unknown
8315,GEMSTONE CHANDELIER T-LIGHT HOLDER,Holders & Stands
8316,SMALL JEWELLERY STAND,Holders & Stands
8317,wake up cockerel calendar sign ,Other/Unknown
8318,zinc wire sweetheart letter tray,Decorative Items
8319,cinderella chandelier ,Other/Unknown
8320,SET OF 10 LANTERNS FAIRY LIGHT STAR,Lighting
8321,Folding Mirror Hot Pink ,Other/Unknown
