product_id,product_name,category
5571,mobile vintage hearts ,Decorative Items
5572,Pink/Flower Rabbit Egg Warmer ,Decorative Items
5573,Baking Mould Easter Egg Milk Choc,Other/Unknown
5574,fancy fonts birthday wrap,Other/Unknown
5575,Door Hanger  Mum + Dads Room,Storage & Organization
5576,vintage kitchen print puddings,Vintage Items
5577,dinosaur party bag + sticker set,Bags & Boxes
5578,Party Invites Spaceman,Other/Unknown
5579,Small Pink Glass Sundae Dish,Other/Unknown
5580,icon placemat pop art elvis,Other/Unknown
5581,pink love heart shape cup,Drinkware
5582,PARTY INVITES FOOTBALL,Other/Unknown
5583,Red Flock Love Heart Photo Frame,Decorative Items
5584,lavender incense in tin,Other/Unknown
5585,Hello Sailor Blue Soap Holder,Holders & Stands
5586,Glass Jar Marmalade ,Other/Unknown
5587,Glass Jar Daisy Fresh Cotton Wool,Other/Unknown
5588,Carousel Design Washbag,Bags & Boxes
5589,baking mould rose white chocolate,Other/Unknown
5590,Skulls Greeting Card,Gifts & Cards
5591,card gingham rose ,Gifts & Cards
5592,TEA TIME TEA SET IN GIFT BOX,Bags & Boxes
5593,3D Sheet Of Cat Stickers,Other/Unknown
5594,Sweeties  Stickers,Other/Unknown
5595,toast its - fairy flower,Decorative Items
5596,"Assorted Flower Colour ""Leis""",Decorative Items
5597,Watering Can Green Dinosaur,Other/Unknown
5598,4 Pear Botanical Dinner Candles,Candles
5599,CAKES AND BOWS GIFT  TAPE,Gifts & Cards
5600,magic sheep wool growing from paper,Other/Unknown
5601,Cake Stand Victorian Filigree Small,Holders & Stands
5602,Woodland Party Bag + Sticker Set,Bags & Boxes
5603,watering can pink bunny,Other/Unknown
5604,VINTAGE BILLBOARD MUG ,Drinkware
5605,Set Of 4 Rose Botanical Candles,Candles
5606,Edwardian Parasol Pink,Other/Unknown
5607,Blue Flock Glass Candleholder,Holders & Stands
5608,White Stitched Wall Clock,Clocks
5609,magnets pack of 4 vintage labels ,Vintage Items
5610,paperweight vintage paisley,Vintage Items
5611,School Desk And Chair ,Other/Unknown
5612,"wrap, carousel",Other/Unknown
5613,Ring Of Roses Birthday Card,Gifts & Cards
5614,card party games ,Gifts & Cards
5615,SMALL PINK GLASS SUNDAE DISH,Other/Unknown
5616,Empire Gift Wrap,Gifts & Cards
5617,Vintage Union Jack Shopping Bag,Bags & Boxes
5618,French Style Embossed Heart Cabinet,Decorative Items
5619,mirror cornice,Other/Unknown
5620,glass chalice green  small ,Other/Unknown
5621,GLASS CHALICE BLUE SMALL ,Other/Unknown
5622,eau de nile heart shape photo frame,Decorative Items
5623,EAU DE NILE JEWELLED T-LIGHT HOLDER,Holders & Stands
5624,wrap green pears ,Other/Unknown
5625,GLASS CLOCHE LARGE,Other/Unknown
5626,Zinc Heart Lattice T-Light Holder,Holders & Stands
5627,tea party birthday card,Gifts & Cards
5628,money box confectionery design,Bags & Boxes
5629,"GREETING CARD, STICKY GORDON",Gifts & Cards
5630,"Greeting Card, Overcrowded Pool.",Gifts & Cards
5631,PAPER BUNTING COLOURED LACE,Other/Unknown
5632,french garden sign blue metal,Other/Unknown
5633,mini cake stand t-light holder,Holders & Stands
5634,STRAWBRY SCENTED VOTIVE CANDLE,Candles
5635,3 hook hanger magic garden,Storage & Organization
5636,decoration  butterfly  magic garden,Decorative Items
5637,Decoration  Pink Chick Magic Garden,Decorative Items
5638,BUNNY DECORATION MAGIC GARDEN,Decorative Items
5639,Birdhouse Decoration Magic Garden,Decorative Items
5640,HERB MARKER PARSLEY,Other/Unknown
5641,Silver Jewelled Mirror Trinket Tray,Other/Unknown
5642,Love Heart Trinket Pot,Decorative Items
5643,Hanging Spring Flower Egg Large,Decorative Items
5644,Hanging Spring Flower Egg Small,Decorative Items
5645,DECORATION WHITE CHICK MAGIC GARDEN,Decorative Items
5646,Decoration  Butterfly  Magic Garden,Decorative Items
5647,Kitty Pencil Erasers,Other/Unknown
5648,75 GREEN FAIRY CAKE CASES,Other/Unknown
5649,bunny wooden painted with flower ,Decorative Items
5650,set of 4 polkadot placemats ,Other/Unknown
5651,Set Of 4 Polkadot Coasters,Other/Unknown
5652,Painted Yellow Wooden Daisy,Other/Unknown
5653,Eight Piece Snake  Set,Other/Unknown
5654,Citrus Garland Felt Flowers ,Decorative Items
5655,Set/4 Badges Dogs,Other/Unknown
5656,SET/4 BADGES BEETLES,Other/Unknown
5657,Danish Rose Round Sewing Box,Bags & Boxes
5658,PARTY INVITES WOODLAND,Other/Unknown
5659,Rainbow Pegs Photo Clip String,Other/Unknown
5660,small tall camphor wood toadstool,Other/Unknown
5661,easter decoration hanging bunny,Decorative Items
5662,EASTER DECORATION SITTING BUNNY,Decorative Items
5663,EASTER DECORATION EGG BUNNY ,Decorative Items
5664,ROSE DU SUD CUSHION COVER,Other/Unknown
5665,garland wooden happy easter,Other/Unknown
5666,pink hearts light chain ,Lighting
5667,union stripe with fringe  hammock,Other/Unknown
5668,Enchanted Bird Plant Cage,Other/Unknown
5669,FRENCH BLUE METAL DOOR SIGN 3,Other/Unknown
5670,Party Pizza Dish Blue Polkadot,Other/Unknown
5671,Cream Felt Easter Egg Basket,Other/Unknown
5672,FELT TOADSTOOL LARGE,Other/Unknown
5673,FRENCH BLUE METAL DOOR SIGN 1,Other/Unknown
5674,FRENCH BLUE METAL DOOR SIGN 0,Other/Unknown
5675,french blue metal door sign 8,Other/Unknown
5676,Set Of 2 Round Tins Camembert ,Other/Unknown
5677,Gift Bag Birthday,Bags & Boxes
5678,3D Sheet Of Dog Stickers,Other/Unknown
5679,Wrap Suki And Friends,Other/Unknown
5680,egg cup natural chicken,Drinkware
5681,easter decoration sitting bunny,Decorative Items
5682,Easter Decoration Egg Bunny ,Decorative Items
5683,LIGHTHOUSE PRINTED METAL SIGN,Lighting
5684,Botanical Lavender Birthday Card,Gifts & Cards
5685,pink gingham cat with scarf,Other/Unknown
5686,BLUE FLY SWAT,Other/Unknown
5687,Hanging Hen On Nest Decoration,Decorative Items
5688,Vintage Kitchen Print Puddings,Vintage Items
5689,ceramic strawberry trinket tray,Other/Unknown
5690,turquoise heart of glass bracelet,Decorative Items
5691,Green Heart Of Glass Bracelet,Decorative Items
5692,pink crystal+glass bracelet,Jewellery
5693,BLACK CHUNKY BEAD BRACELET W STRAP,Jewellery
5694,turquoise crystal+glass bracelet,Jewellery
5695,resin bracelet w pastel beads,Jewellery
5696,Resin Necklace W Pastel Beads,Jewellery
5697,Pink  Honeycomb Paper Ball ,Other/Unknown
5698,jigsaw tree with birdhouse,Other/Unknown
5699,easter craft 4 chicks ,Other/Unknown
5700,Large Circular Mirror Mobile,Other/Unknown
5701,Metal Tube Chime On Bamboo,Other/Unknown
5702,CREAM FELT EASTER EGG BASKET,Other/Unknown
5703,BUNNY WOODEN PAINTED WITH BIRD ,Other/Unknown
5704,happy easter hanging decoration,Decorative Items
5705,ass col small sand gecko p'weight,Other/Unknown
5706,sewing susan 21 needle set,Other/Unknown
5707,GARLAND WOODEN HAPPY EASTER,Other/Unknown
5708,"Charlie+Lola""Extremely Busy"" Sign",Other/Unknown
5709,Keep Out Boys Door Hanger ,Storage & Organization
5710,Charlie+Lola My Room Door Sign,Other/Unknown
5711,CHARLIE+LOLA MY ROOM DOOR SIGN,Other/Unknown
5712,"CHARLIE+LOLA""EXTREMELY BUSY"" SIGN",Other/Unknown
5713,3 gardenia morris boxed candles,Bags & Boxes
5714,ridged glass finger bowl,Other/Unknown
5715,Happy Easter Hanging Decoration,Decorative Items
5716,jazz hearts address book,Decorative Items
5717,Elephant Carnival Pouffe,Other/Unknown
5718,HEART CALCULATOR,Decorative Items
5719,Vintage Red Mug,Drinkware
5720,WHITE JEWELLED HEART DECORATION,Decorative Items
5721,set of 36 mushroom paper doilies,Other/Unknown
5722,wrap circus parade,Other/Unknown
5723,assorted monkey suction cup hook,Storage & Organization
5724,Assorted Monkey Suction Cup Hook,Storage & Organization
5725,beaded pearl heart white on stick,Decorative Items
5726,CERAMIC LOVE HEART MONEY BANK,Decorative Items
5727,new baroque jewellery box ,Bags & Boxes
5728,NEW BAROQUE BLACK BOXES,Bags & Boxes
5729,MOROCCAN BEATEN METAL MIRROR,Other/Unknown
5730,assorted colour t-light holder,Holders & Stands
5731,LOVE GARLAND PAINTED ZINC ,Other/Unknown
5732,mini ladle love heart red ,Decorative Items
5733,beach hut key cabinet,Other/Unknown
5734,DOG TOY WITH PINK CROCHET SKIRT,Toys & Games
5735,pack 3 fire engine/car patches,Other/Unknown
5736,PACK 6 HEART/ICE-CREAM PATCHES,Decorative Items
5737,tea time table cloth,Other/Unknown
5738,Pink Metal Chicken Heart ,Decorative Items
5739,SCOTTIE DOGS BABY BIB,Other/Unknown
5740,Blue Tv Tray Table ,Other/Unknown
5741,RECYCLED PENCIL WITH RABBIT ERASER,Other/Unknown
5742,FELT FARM ANIMAL WHITE BUNNY ,Other/Unknown
5743,PINK PAISLEY ROSE GIFT WRAP,Gifts & Cards
5744,WRAP DAISY CARPET ,Other/Unknown
5745,Jasmine Votive Candle,Candles
5746,Daisy Notebook ,Books & Stationery
5747,ABSTRACT CIRCLE JOURNAL ,Other/Unknown
5748,MEDINA STAMPED METAL STOOL,Other/Unknown
5749,french blue metal door sign 9,Other/Unknown
5750,PACK OF 12 CIRCUS PARADE TISSUES ,Other/Unknown
5751,OVEN MITT APPLES DESIGN,Other/Unknown
5752,Square Floor Cushion Vintage Red,Vintage Items
5753,DOORMAT TOPIARY,Other/Unknown
5754,BOYS VINTAGE TIN SEASIDE BUCKET,Vintage Items
5755,red metal beach spade ,Other/Unknown
5756,DINOSAUR HEIGHT CHART STICKER SET,Other/Unknown
5757,Set Of 6 Vintage Notelets Kit,Vintage Items
5758,pink hearts paper garland,Decorative Items
5759,english rose metal waste bin,Other/Unknown
5760,blue crusoe check lampshade,Other/Unknown
5761,mirror love bird t-light holder,Holders & Stands
5762,mini jigsaw bake a cake ,Other/Unknown
5763,set of 16 vintage sky blue cutlery,Vintage Items
5764,Set Of 16 Vintage Red Cutlery,Vintage Items
5765,vintage kitchen print fruits,Vintage Items
5766,Vintage Kitchen Print Vegetables,Vintage Items
5767,Fruit Tree And Birds Wall Plaque,Other/Unknown
5768,FOOD/DRINK SPONGE STICKERS,Other/Unknown
5769,75 Green Fairy Cake Cases,Other/Unknown
5770,large circular mirror mobile,Other/Unknown
5771,dolly mixture children's umbrella,Other/Unknown
5772,First Class Passport Cover ,Other/Unknown
5773,First Class Luggage Tag ,Other/Unknown
5774,SILVER ROCOCO CANDLE STICK,Candles
5775,Number Tile Vintage Font No ,Vintage Items
5776,NUMBER TILE VINTAGE FONT 7,Vintage Items
5777,Number Tile Vintage Font 6 ,Vintage Items
5778,number tile vintage font 2,Vintage Items
5779,number tile vintage font 1,Vintage Items
5780,number tile vintage font 0,Vintage Items
5781,set of 6 girls celebration candles,Candles
5782,assorted easter decorations  bells,Decorative Items
5783,TROPICAL  HONEYCOMB PAPER GARLAND ,Other/Unknown
5784,TOYBOX  WRAP ,Bags & Boxes
5785,CHEST 7 DRAWER MA CAMPAGNE,Other/Unknown
5786,BIRDHOUSE GARDEN MARKER ,Other/Unknown
5787,CHARLIE & LOLA WASTEPAPER BIN BLUE,Other/Unknown
5788,Easter Decoration Hanging Bunny,Decorative Items
5789,Daisies  Honeycomb Garland ,Other/Unknown
5790,Blue Calculator Ruler,Other/Unknown
5791,DECORATION  PINK CHICK MAGIC GARDEN,Decorative Items
5792,EASTER DECORATION HANGING BUNNY,Decorative Items
5793,HANGING WOOD AND FELT BUTTERFLY ,Other/Unknown
5794,HANGING WOOD AND FELT FLOWER,Decorative Items
5795,PAINTED YELLOW WOODEN DAISY,Other/Unknown
5796,set of 12 mini bunnies in a bucket,Other/Unknown
5797,STRAWBERRY DREAM CHILDS UMBRELLA,Other/Unknown
5798,EIGHT PIECE DINOSAUR SET,Other/Unknown
5799,Animal Stickers,Other/Unknown
5800,NINJA RABBIT BLACK,Other/Unknown
5801,ninja rabbit pink,Other/Unknown
5802,decorative flore bathroom bottle,Drinkware
5803,Asstd Fruit+Flowers Fridge Magnets,Decorative Items
5804,FRIDGE MAGNETS LA VIE EN ROSE,Other/Unknown
5805,36 doilies dolly girl,Other/Unknown
5806,Glass Jar Digestive Biscuits,Other/Unknown
5807,"KEY FOB , FRONT  DOOR ",Other/Unknown
5808,pink heart red handbag,Bags & Boxes
5809,NUMBER TILE COTTAGE GARDEN 1,Other/Unknown
5810,LITTLE PINK MONSTER SOFT TOY,Toys & Games
5811,TEA TIME TEA TOWELS ,Other/Unknown
5812,Pink Cherry Lights,Lighting
5813,hanging ridge glass t-light holder,Holders & Stands
5814,Number Tile Vintage Font 1,Vintage Items
5815,NUMBER TILE VINTAGE FONT 2,Vintage Items
5816,NUMBER TILE VINTAGE FONT 3,Vintage Items
5817,NUMBER TILE VINTAGE FONT 4,Vintage Items
5818,Number Tile Vintage Font 5,Vintage Items
5819,NUMBER TILE VINTAGE FONT 6 ,Vintage Items
5820,number tile vintage font 7,Vintage Items
5821,NUMBER TILE VINTAGE FONT NO ,Vintage Items
5822,bathroom metal sign ,Other/Unknown
5823,cake stand white two tier lace,Holders & Stands
5824,HANGING METAL RABBIT DECORATION,Decorative Items
5825,HANGING CHICK GREEN DECORATION,Decorative Items
5826,Green/Blue Flower Design Big Mug,Drinkware
5827,Colourful Flower Fruit Bowl,Decorative Items
5828,HANGING MEDINA LANTERN SMALL,Lighting
5829,Citronella Candle Garden Pot,Candles
5830,BLACK MINI TAPE MEASURE ,Other/Unknown
5831,S/4 PINK FLOWER CANDLES IN BOWL,Decorative Items
5832,Egg Cup Natural Chicken,Drinkware
5833,Hen House Decoration,Decorative Items
5834,easter decoration egg bunny ,Decorative Items
5835,Set/10 Ivory Polkadot Party Candles,Candles
5836,Set/10 Blue Polkadot Party Candles,Candles
5837,SET/10 BLUE POLKADOT PARTY CANDLES,Candles
5838,EASTER TIN BUCKET,Other/Unknown
5839,3d hearts  honeycomb paper garland,Decorative Items
5840,easter tree yellow birds,Other/Unknown
5841,Calendar Family Favourites,Other/Unknown
5842,Eau De Nile Heart Shape Photo Frame,Decorative Items
5843,Set/4 Blue Flower Candles In Bowl,Decorative Items
5844,silver aperitif glass,Other/Unknown
5845,hall cabinet with 3 drawers,Other/Unknown
5846,pink metal chicken heart ,Decorative Items
5847,WOODEN ADVENT CALENDAR RED,Other/Unknown
5848,First Class Holiday Purse ,Other/Unknown
5849,Glass Cake Cover And Plate,Other/Unknown
5850,bird decoration green polkadot,Decorative Items
5851,eau de nil love bird candle,Candles
5852,Pink Love Bird Candle,Candles
5853,SET OF 4 POLKADOT PLACEMATS ,Other/Unknown
5854,small skull windmill,Other/Unknown
5855,Scottie Dogs Baby Bib,Other/Unknown
5856,PINK POLKADOT KIDS BAG,Bags & Boxes
5857,zinc top  2 door wooden shelf ,Other/Unknown
5858,large chinese style scissor,Other/Unknown
5859,mirror mosaic t-light holder round,Holders & Stands
5860,moody boy  door hanger ,Storage & Organization
5861,Mirrored Wall Art Photo Frames,Other/Unknown
5862,wrap doiley design,Other/Unknown
5863,vintage union jack pennant,Vintage Items
5864,Jungle Popsicles Ice Lolly Holders,Holders & Stands
5865,Blue Knitted Hen ,Other/Unknown
5866,Set/3 Rose Candle In Jewelled Box,Bags & Boxes
5867,Ceramic Strawberry Trinket Tray,Other/Unknown
5868,love heart trinket pot,Decorative Items
5869,Rose Scent Candle Jewelled Drawer,Candles
5870,PINK RETRO BIG FLOWER BAG,Bags & Boxes
5871,Red Retrospot Shopping Bag,Bags & Boxes
5872,Pack Of 6 Skull Paper Plates,Other/Unknown
5873,set of 6 funky beakers,Other/Unknown
5874,"TUMBLER, NEW ENGLAND",Other/Unknown
5875,hanging hen on nest decoration,Decorative Items
5876,SUNFLOWER DECORATIVE PARASOL,Decorative Items
5877,ASSTD MULTICOLOUR CIRCLES MUG,Drinkware
5878,WOODLAND STORAGE BOX LARGE ,Bags & Boxes
5879,Woodland Storage Box Small,Bags & Boxes
5880,beaded crystal heart pink large,Decorative Items
5881,mini ladle love heart pink,Decorative Items
5882,White/Pink Chick Decoration,Decorative Items
5883,set of 4 english rose placemats,Other/Unknown
5884,Set/6 Collage Paper Cups,Drinkware
5885,wrap alphabet design,Other/Unknown
5886,PINK FELT EASTER EGG BASKET,Other/Unknown
5887,Blue Felt Easter Egg Basket,Other/Unknown
5888,Retro Plastic Elephant Tray,Other/Unknown
5889,cake stand victorian filigree small,Holders & Stands
5890,ANIMAL STICKERS,Other/Unknown
5891,SET OF 6 VINTAGE NOTELETS KIT,Vintage Items
5892,Dog Bowl Vintage Cream,Vintage Items
5893,WRAP ALPHABET DESIGN,Other/Unknown
5894,Folk Felt Hanging Multicol Garland,Other/Unknown
5895,pack/12 blue folkart cards,Gifts & Cards
5896,HANGING SPRING FLOWER EGG LARGE,Decorative Items
5897,HANGING BUTTERFLY  EGG,Other/Unknown
5898,funky monkey gift bag medium,Bags & Boxes
5899,Recycled Pencil With Rabbit Eraser,Other/Unknown
5900,YELLOW GIANT GARDEN THERMOMETER,Other/Unknown
5901,MOROCCAN TEA GLASS,Other/Unknown
5902,Polkadot Mug Pink ,Drinkware
5903,pink hanging gingham easter hen,Other/Unknown
5904,BLUE HANGING GINGHAM EASTER HEN,Other/Unknown
5905,"decoration , wobbly chicken, metal ",Decorative Items
5906,PINK BABY BUNTING,Other/Unknown
5907,BUNNY EGG GARLAND,Other/Unknown
5908,Black Orange Squeezer,Other/Unknown
5909,Blond Doll Doorstop,Other/Unknown
5910,Black/White Glass/Silver Bracelet,Jewellery
5911,red   acrylic faceted bangle,Other/Unknown
5912,Childs Garden Trowel Blue ,Other/Unknown
5913,felt egg cosy blue rabbit ,Other/Unknown
5914,enamel blue rim biscuit bin,Other/Unknown
5915,yellow easter egg hunt start post,Decorative Items
5916,GREEN EASTER EGG HUNT START POST,Decorative Items
5917,S/12 MINI RABBIT EASTER,Other/Unknown
5918,FELT EGG COSY BLUE RABBIT ,Other/Unknown
5919,MINI PAINTED GARDEN DECORATION ,Decorative Items
5920,S/12 Mini Rabbit Easter,Other/Unknown
5921,EASTER BUNNY GARLAND OF FLOWERS,Decorative Items
5922,Vintage Red Teatime Mug,Drinkware
5923, OVAL WALL MIRROR DIAMANTE ,Other/Unknown
5924,Set/6 Collage Paper Plates,Other/Unknown
5925,SET/6 COLLAGE PAPER CUPS,Drinkware
5926,FELT FARM ANIMAL RABBIT,Other/Unknown
5927,felt farm animal chicken,Other/Unknown
5928,Number Tile Cottage Garden 4,Other/Unknown
5929,clear milkshake glass,Other/Unknown
5930,Queens Guard Coffee Mug,Drinkware
5931,Pink B'Fly C/Cover W Bobbles,Other/Unknown
5932,CANDY SPOT CUSHION COVER,Other/Unknown
5933,COFFEE MUG APPLES DESIGN,Drinkware
5934,Aqua Bertie Glass Bead Bag Charm,Bags & Boxes
5935,Economy Luggage Tag,Other/Unknown
5936,Blue Polkadot Luggage Tag ,Other/Unknown
5937,Stripey Chocolate Nesting Boxes,Bags & Boxes
5938,cake stand lovebird 2 tier white,Holders & Stands
5939,Cake Stand Lovebird 2 Tier Pink,Holders & Stands
5940,Set 3 Paper Vintage Chick Paper Egg,Vintage Items
5941,MIRRORED WALL ART LADIES,Other/Unknown
5942,Beaded Crystal Heart Pink On Stick,Decorative Items
5943,beaded crystal heart blue on stick,Decorative Items
5944,Beaded Crystal Heart Green On Stick,Decorative Items
5945,Ivory Hanging Decoration  Bird,Decorative Items
5946,Set 4 Nursery Des Round Boxes,Bags & Boxes
5947,set/4 red mini rose candle in bowl,Candles
5948,asstd rasta key-chains,Other/Unknown
5949,Wrap Poppies  Design,Other/Unknown
5950,"WRAP, BILLBOARD FONTS DESIGN",Other/Unknown
5951,Bunny Decoration Magic Garden,Decorative Items
5952,PAIR PADDED HANGERS PINK CHECK,Storage & Organization
5953,Coffee Scent Pillar Candle,Candles
5954,Set/3 Polkadot Stacking Tins,Other/Unknown
5955,Hippy Chic Decorative Parasol,Decorative Items
5956,SET 3 SONG BIRD PAPER EGGS ASSORTED,Other/Unknown
5957,Candy Spot Egg Warmer Rabbit,Other/Unknown
5958,MINI WOODEN HAPPY BIRTHDAY GARLAND,Other/Unknown
5959,STRAWBERRY   PICNIC BAG,Bags & Boxes
5960,HEART GARLAND RUSTIC PADDED,Decorative Items
5961,CITRONELLA CANDLE GARDEN POT,Candles
5962,Easter Tin Chicks Pink Daisy,Other/Unknown
5963,EASTER BUNNY HANGING GARLAND,Other/Unknown
5964,pink felt easter egg basket,Other/Unknown
5965,bag 500g swirly marbles,Bags & Boxes
5966,SMALL HANGING GLASS+ZINC LANTERN,Lighting
5967,red flock love heart photo frame,Decorative Items
5968,BUNNY EGG BOX,Bags & Boxes
5969,Pin Cushion Babushka Red,Other/Unknown
5970,PINK HEART RED HANDBAG,Bags & Boxes
5971,SET 3 PAPER VINTAGE CHICK PAPER EGG,Vintage Items
5972,Easter Bunny With Basket On Back,Other/Unknown
5973,"DECORATION , WOBBLY CHICKEN, METAL ",Decorative Items
5974,green easter egg hunt start post,Decorative Items
5975,BLUE EASTER EGG HUNT START POST,Decorative Items
5976,Easter Decoration Sitting Bunny,Decorative Items
5977,3 Pink Hen+Chicks In Basket,Other/Unknown
5978,12 Pink Hen+Chicks In Basket,Other/Unknown
5979,easter bunny wreath,Other/Unknown
5980,Frog King Watering Can,Other/Unknown
5981,set 3 paper vintage chick paper egg,Vintage Items
5982,36 DOILIES DOLLY GIRL,Other/Unknown
5983,Origami Sandlewood Incense+Flower,Decorative Items
5984,Origami Rose Incense/Candle Set ,Candles
5985,fairy dreams incense ,Other/Unknown
5986,lavender incense 40 cones in tin,Other/Unknown
5987,assorted laquered incense holders,Holders & Stands
5988,set of 4 polkadot coasters,Other/Unknown
5989,tea time tea set in gift box,Bags & Boxes
5990,Multicolour  Confetti In Tube,Other/Unknown
5991,50Cm Metal String With  7 Clips,Other/Unknown
5992,hanging photo clip rope ladder,Other/Unknown
5993,Assorted Shapes Photo Clip Silver ,Other/Unknown
5994,silver jewelled mirror trinket tray,Other/Unknown
5995,SILVER PHOTO FRAME,Other/Unknown
5996,Blue Polkadot Egg Cup ,Drinkware
5997,WRAP VINTAGE PETALS  DESIGN,Vintage Items
5998,wrap poppies  design,Other/Unknown
5999,WRAP DOILEY DESIGN,Other/Unknown
6000,HANGING CHICK CREAM DECORATION,Decorative Items
6001,PINK BUTTERFLY CUSHION COVER ,Other/Unknown
6002,pink b'fly c/cover w bobbles,Other/Unknown
6003,love garland painted zinc ,Other/Unknown
6004,PINK PAPER PARASOL ,Other/Unknown
6005,BEADED CRYSTAL HEART GREEN SMALL,Decorative Items
6006,vintage glass coffee caddy,Vintage Items
6007,Clam Shell Small ,Other/Unknown
6008,easter tin keepsake,Other/Unknown
6009,white brocante soap dish,Other/Unknown
6010,Blue Travel First Aid Kit,Other/Unknown
6011,ENAMEL PINK COFFEE CONTAINER,Other/Unknown
6012,Felt Egg Cosy White Rabbit ,Other/Unknown
6013,White Candystuft Artificial Flower,Decorative Items
6014,Folding Umbrella Blackblue Polkadot,Other/Unknown
6015,easter tin bucket,Other/Unknown
6016,PINK METAL CHICKEN HEART ,Decorative Items
6017,2 Picture Book Eggs Easter Bunny,Books & Stationery
6018,box/12 chick & egg in basket,Bags & Boxes
6019,bunny egg box,Bags & Boxes
6020,PINK METAL SWINGING BUNNY,Other/Unknown
6021,Assorted Farmyard Animals In Bucket,Other/Unknown
6022,RED PAPER PARASOL,Other/Unknown
6023,YELLOW METAL CHICKEN HEART ,Decorative Items
6024,Hanging Chick  Yellow Decoration,Decorative Items
6025,Mini  Zinc Garden Decorations ,Decorative Items
6026,Easter Tree Yellow Birds,Other/Unknown
6027,Enamel Blue Rim Coffee Container,Other/Unknown
6028,Chest Natural Wood 20 Drawers,Other/Unknown
6029,MEDIUM CERAMIC TOP STORAGE JAR,Other/Unknown
6030,Cherry Blossom  Decorative Flask,Decorative Items
6031,ZINC HEART LATTICE 2 WALL PLANTER,Decorative Items
6032,Green Easter Egg Hunt Start Post,Decorative Items
6033,union flag windsock,Other/Unknown
6034,Flag Of St George ,Other/Unknown
6035,Flower Purple Clock W/Sucker,Decorative Items
6036,Party Invites Balloon Girl,Other/Unknown
6037,pack of 6 skull paper plates,Other/Unknown
6038,frog candle,Candles
6039,Scented Candle In Digitalis Tin,Candles
6040,12 Red Rose Peg Place Settings,Other/Unknown
6041,FORKED CACTUS CANDLE,Candles
6042,blue polkadot kids bag,Bags & Boxes
6043,CLASSIC FRENCH STYLE BASKET GREEN ,Other/Unknown
6044,CHILDS GARDEN RAKE BLUE,Other/Unknown
6045,mini jigsaw dinosaur ,Other/Unknown
6046,Jardin Etched Glass Fruitbowl,Other/Unknown
6047,JARDIN ETCHED GLASS CHEESE DISH,Other/Unknown
6048,BLUE VICTORIAN FABRIC OVAL BOX,Bags & Boxes
6049,sweetheart wire wall tidy,Decorative Items
6050,Red Metal Beach Spade ,Other/Unknown
6051,CHILDS GARDEN RAKE PINK,Other/Unknown
6052,childs garden rake blue,Other/Unknown
6053,tropical passport cover ,Other/Unknown
6054,PINK FLOWER CROCHET FOOD COVER,Decorative Items
6055,PING! MICROWAVE PLATE,Other/Unknown
6056,ASSORTED EASTER GIFT TAGS,Gifts & Cards
6057,assorted easter gift tags,Gifts & Cards
6058,PACK OF 6 SKULL PAPER CUPS,Drinkware
6059,Hen House W Chick Standing,Holders & Stands
6060,Hen House W Family In Barn & Nest,Other/Unknown
6061,2 picture book eggs easter bunny,Books & Stationery
6062,3 PINK HEN+CHICKS IN BASKET,Other/Unknown
6063,Box/12 Chick & Egg In Basket,Bags & Boxes
6064,Multicolour Rabbit Egg Warmer,Other/Unknown
6065,eau de nile jewelled photoframe,Other/Unknown
6066,3D HEARTS  HONEYCOMB PAPER GARLAND,Decorative Items
6067,set of 6 heart chopsticks,Decorative Items
6068,Gift Bag Psychedelic Apples,Bags & Boxes
6069,jigsaw toadstools 3 piece,Other/Unknown
6070,WRAP POPPIES  DESIGN,Other/Unknown
6071,Red/Cream Stripe Cushion Cover ,Other/Unknown
6072,Union Stripe Cushion Cover ,Other/Unknown
6073,EMPIRE DESIGN ROSETTE,Other/Unknown
6074,Pink Cherry Blossom Cup & Saucer,Drinkware
6075,"Retro ""Tea For One"" ",Other/Unknown
6076,"DIAMANTE HEART SHAPED WALL MIRROR, ",Decorative Items
6077,Set Of 36 Doilies Spaceboy Design ,Other/Unknown
6078,"LETTER ""R"" BLING KEY RING",Keyrings
6079,Mini Jigsaw Bunnies,Other/Unknown
6080,Set 3 Song Bird Paper Eggs Assorted,Other/Unknown
6081,Four Rabbit Easter Decorations,Decorative Items
6082,SET OF 4 POLKADOT COASTERS,Other/Unknown
6083,set of 4 green carousel coasters,Other/Unknown
6084,Columbian Cube Candle,Candles
6085,Hanging Medina Lantern Small,Lighting
6086,set/4 spring flower decoration,Decorative Items
6087,green geisha girl ,Other/Unknown
6088,Blue Geisha Girl ,Other/Unknown
6089,Bunny Egg Box,Bags & Boxes
6090,Felt Farm Animal Hen,Other/Unknown
6091,SMALL ROUND CUT GLASS CANDLESTICK,Candles
6092,Tea Cosy Red  Stripe,Other/Unknown
6093,small round cut glass candlestick,Candles
6094,Polyester Filler Pad 40X40Cm,Other/Unknown
6095,HEN PARTY CORDON BARRIER TAPE,Other/Unknown
6096,PINK HYDRANGEA ART FLOWER,Decorative Items
6097,Cream Delphinium Artificial Flower,Decorative Items
6098,Painted Pink Rabbit ,Other/Unknown
6099,Wrap Monster Fun ,Other/Unknown
6100,Daisy Garden Marker,Other/Unknown
6101,Rattle Snake Eggs,Other/Unknown
6102,Small White/Pink Rose Art Flower,Decorative Items
6103,gold scroll glass t-light holder,Holders & Stands
6104,ANTIQUE CREAM CUTLERY SHELF ,Vintage Items
6105,COFFEE SCENT PILLAR CANDLE,Candles
6106,RETRO PLASTIC 70'S TRAY,Other/Unknown
6107,Oyster Trinket Box,Bags & Boxes
6108,dinosaur height chart sticker set,Other/Unknown
6109,Wrap Alphabet Design,Other/Unknown
6110,wrap vintage petals  design,Vintage Items
6111,SET OF 72 SKULL PAPER  DOILIES,Other/Unknown
6112,Ass Col Circle Mobile ,Other/Unknown
6113,Assorted Circular Mobile,Other/Unknown
6114,ASS COL CIRCLE MOBILE ,Other/Unknown
6115,Blue Paisley Journal ,Other/Unknown
6116,Beaded Crystal Heart Blue  Large,Decorative Items
6117,pink/flower rabbit egg warmer ,Decorative Items
6118,easter tin chicks pink daisy,Other/Unknown
6119,Easter Tin Bunny Bouquet,Other/Unknown
6120,GREEN FERN POCKET BOOK,Books & Stationery
