product_id,product_name,category
2804,LOCAL CAFE MUG,Drinkware
2805,Red Tea Towel Classic Design,Other/Unknown
2806,METAL SIGN NEIGHBOURHOOD WITCH ,Other/Unknown
2807,Pack 6 Heart/Ice-Cream Patches,Decorative Items
2808,"Key Fob , Shed",Other/Unknown
2809,bag of silver stones,Bags & Boxes
2810,SKULLS SQUARE TISSUE BOX,Bags & Boxes
2811,ivory pillar candle silver flock,Candles
2812,ivory pillar candle gold flock,Candles
2813,small licorice des pink bowl,Other/Unknown
2814,union jack flag passport cover ,Other/Unknown
2815,ABSTRACT CIRCLES SKETCHBOOK ,Books & Stationery
2816,LADS ONLY TISSUE BOX,Bags & Boxes
2817,RED STAR CARD HOLDER,Holders & Stands
2818,HEART FILIGREE DOVE LARGE,Decorative Items
2819,WOODEN OWLS LIGHT GARLAND ,Lighting
2820,set of 9 heart shaped balloons,Decorative Items
2821,fairy cakes notebook a6 size,Books & Stationery
2822,FAIRY CAKES NOTEBOOK A7 SIZE,Books & Stationery
2823,OVERNIGHT BAG VINTAGE ROSE PAISLEY,Bags & Boxes
2824,TEA TIME BREAKFAST BASKET,Other/Unknown
2825,tea time party bunting,Other/Unknown
2826,MULTI HEARTS  STICKERS,Decorative Items
2827,ALPHABET HEARTS STICKER SHEET,Decorative Items
2828,CUTE CATS TAPE,Other/Unknown
2829,skulls tape,Other/Unknown
2830,large cake towel pink spots,Other/Unknown
2831,folkart star christmas decorations,Decorative Items
2832,HEARTS  STICKERS,Decorative Items
2833,ASS COLOUR GLOWING TIARAS,Other/Unknown
2834,white bell honeycomb paper garland ,Other/Unknown
2835,FAIRY CAKE NOTEBOOK A5 SIZE,Books & Stationery
2836,swiss chalet tree decoration ,Decorative Items
2837,BINGO SET,Other/Unknown
2838,circus parade childrens egg cup ,Drinkware
2839,bag 125g swirly marbles,Bags & Boxes
2840,KINGS CHOICE BISCUIT TIN,Other/Unknown
2841,HOLIDAY FUN LUDO,Other/Unknown
2842,space frog,Other/Unknown
2843,SET OF 3 NOTEBOOKS IN PARCEL,Books & Stationery
2844,RED COAT RACK PARIS FASHION,Other/Unknown
2845,SMALL SILVER TRELLIS CANDLEPOT,Candles
2846,glass jar peacock bath salts,Other/Unknown
2847,robin christmas card,Gifts & Cards
2848,black christmas tree 60cm,Other/Unknown
2849,FELTCRAFT HAIRBAND PINK AND PURPLE,Other/Unknown
2850,CARD CHRISTMAS VILLAGE,Gifts & Cards
2851,Strawberry Lunch Box With Cutlery,Bags & Boxes
2852,blue diner wall clock,Clocks
2853,poppy's playhouse bathroom,Other/Unknown
2854,AIRLINE BAG VINTAGE JET SET RED,Bags & Boxes
2855,CERAMIC CHERRY CAKE MONEY BANK,Other/Unknown
2856,Make Your Own Playtime Card Kit,Gifts & Cards
2857,happy stencil craft,Other/Unknown
2858,SOMBRERO ,Other/Unknown
2859,Green Polkadot Bowl,Other/Unknown
2860,Rain Poncho ,Other/Unknown
2861,POLKADOT RAIN HAT ,Other/Unknown
2862,36 Pencils Tube Posy,Other/Unknown
2863,Skulls Square Tissue Box,Bags & Boxes
2864,Skulls  Water Transfer Tattoos ,Other/Unknown
2865,FOLKART ZINC STAR CHRISTMAS DEC,Decorative Items
2866,skull shoulder bag,Bags & Boxes
2867,"String Of 8 Butterflies,Pink",Other/Unknown
2868,Glitter Hanging Butterfly String,Other/Unknown
2869,HOME SWEET HOME METAL SIGN ,Other/Unknown
2870,Wood And Glass Medicine Cabinet,Other/Unknown
2871,Utilty Cabinet With Hooks,Storage & Organization
2872,Red Spot Ceramic Drawer Knob,Other/Unknown
2873,French Blue Metal Door Sign 9,Other/Unknown
2874,charlie+lola pink hot water bottle,Drinkware
2875,Wooden Advent Calendar Cream,Other/Unknown
2876,BATHROOM SCALES RUBBER DUCKS,Other/Unknown
2877,childrens apron apples design,Other/Unknown
2878,FLOOR CUSHION ELEPHANT CARNIVAL,Other/Unknown
2879,Red Retrospot Tea Cup And Saucer ,Drinkware
2880,green 3 piece polkadot cutlery set,Other/Unknown
2881,VICTORIAN SEWING BOX LARGE,Bags & Boxes
2882,christmas hanging tree with bell,Other/Unknown
2883,Potting Shed Tea Mug,Drinkware
2884,Green Christmas Tree Card Holder,Holders & Stands
2885,PLASTERS IN TIN SPACEBOY,Other/Unknown
2886,card birthday cowboy,Gifts & Cards
2887,RABBIT  DESIGN  COTTON TOTE BAG,Bags & Boxes
2888,woodland party bag + sticker set,Bags & Boxes
2889,DINOSAUR PARTY BAG + STICKER SET,Bags & Boxes
2890,plasters in tin circus parade ,Other/Unknown
2891,JIGSAW TREE WITH BIRDHOUSE,Other/Unknown
2892,pack of 60 spaceboy cake cases,Other/Unknown
2893,EASTER TIN BUNNY BOUQUET,Other/Unknown
2894,EASTER TIN CHICKS PINK DAISY,Other/Unknown
2895,wooden happy birthday garland,Other/Unknown
2896,CREAM SLICE FLANNEL CHOCOLATE SPOT ,Other/Unknown
2897,Jingle Bells Tree Decoration,Decorative Items
2898,motoring tissue box,Bags & Boxes
2899,empire tissue box,Bags & Boxes
2900,Pack Of 6 Sandcastle Flags Assorted,Other/Unknown
2901,Rabbit  Design  Cotton Tote Bag,Bags & Boxes
2902,SWALLOW SQUARE TISSUE BOX,Bags & Boxes
2903,PACK OF 20 NAPKINS PANTRY DESIGN,Other/Unknown
2904,HAPPY STENCIL CRAFT,Other/Unknown
2905,S/4 Cacti Candles,Candles
2906,UNION JACK FLAG PASSPORT COVER ,Other/Unknown
2907,pink union jack  passport cover ,Other/Unknown
2908,Kensington Coffee Set,Other/Unknown
2909,CARAVAN SQUARE TISSUE BOX,Bags & Boxes
2910,set/12 funky felt flower peg in bag,Bags & Boxes
2911,lavender scented fabric heart,Decorative Items
2912,party cones candy tree decoration,Decorative Items
2913,Party Cones Candy Assorted,Other/Unknown
2914,SET OF 6 T-LIGHTS EASTER CHICKS,Lighting
2915,"LARGE CAKE TOWEL, CHOCOLATE SPOTS",Other/Unknown
2916,Pink Padded Mobile,Other/Unknown
2917,RED RETROSPOT TISSUE BOX,Bags & Boxes
2918,s/12 mini rabbit easter,Other/Unknown
2919,NOVELTY BISCUITS CAKE STAND 3 TIER,Holders & Stands
2920,novelty biscuits cake stand 3 tier,Holders & Stands
2921,Gumball Monochrome Coat Rack,Other/Unknown
2922,blue coat rack paris fashion,Other/Unknown
2923,tea for one polkadot,Other/Unknown
2924,ROCKING HORSE RED CHRISTMAS ,Other/Unknown
2925,medium medina stamped metal bowl ,Other/Unknown
2926,TEA FOR ONE POLKADOT,Other/Unknown
2927,Cream Wall Planter Heart Shaped,Decorative Items
2928,Cream Heart Card Holder,Holders & Stands
2929,MIRROR CORNICE,Other/Unknown
2930,New Baroque Black Photo Album,Other/Unknown
2931,BLUE & WHITE BREAKFAST TRAY,Other/Unknown
2932,Chocolate 3 Wick Morris Box Candle,Bags & Boxes
2933,Tea For One Polkadot,Other/Unknown
2934,"KEY FOB , GARAGE DESIGN",Other/Unknown
2935,"Metal Sign,Cupcake Single Hook",Storage & Organization
2936,MOODY GIRL DOOR HANGER ,Storage & Organization
2937,retro plastic 70's tray,Other/Unknown
2938,Toast Its - Fairy Flower,Decorative Items
2939,Wooden Rounders Garden Set ,Other/Unknown
2940,glass heart t-light holder ,Holders & Stands
2941,PAPER POCKET TRAVELING FAN ,Other/Unknown
2942,scottie dogs baby bib,Other/Unknown
2943,Antique Glass Heart Decoration ,Decorative Items
2944,Beaded Crystal Heart Pink Small,Decorative Items
2945,Heart Wooden Christmas Decoration,Decorative Items
2946,set of 4 napkin charms hearts,Decorative Items
2947,Set Of 4 Napkin Charms 3 Keys ,Other/Unknown
2948,heart decoration with pearls ,Decorative Items
2949,beaded crystal heart green small,Decorative Items
2950,HANGING FAIRY CAKE DECORATION,Decorative Items
2951,beaded crystal heart pink small,Decorative Items
2952,Set 20 Napkins Fairy Cakes Design ,Other/Unknown
2953,Owl Doorstop,Other/Unknown
2954,Vintage Union Jack Doorstop,Vintage Items
2955,Blue Teatime Print Bowl ,Other/Unknown
2956,glitter hanging butterfly string,Other/Unknown
2957,fairy cake design umbrella,Other/Unknown
2958,feltcraft cushion rabbit,Other/Unknown
2959,set of 4 fairy cake placemats ,Other/Unknown
2960,MAN FLU METAL SIGN,Other/Unknown
2961,FANNY'S REST STOPMETAL SIGN,Other/Unknown
2962,hand over the chocolate   sign ,Other/Unknown
2963,HOUSE WRECKING METAL SIGN ,Other/Unknown
2964,Porcelain Rose Small,Other/Unknown
2965,classic metal birdcage plant holder,Holders & Stands
2966,LOVE LARGE WOOD LETTERS ,Other/Unknown
2967,Enamel Watering Can Cream,Other/Unknown
2968,Jumbo Bag Toys ,Bags & Boxes
2969,CARD MOTORBIKE SANTA,Gifts & Cards
2970,Silver Diamante Pen In Gift Box,Bags & Boxes
2971,Heart Decoration With Pearls ,Decorative Items
2972,SET/10 PINK POLKADOT PARTY CANDLES,Candles
2973,60 TEATIME FAIRY CAKE CASES,Other/Unknown
2974,Set Of 6 Girls Celebration Candles,Candles
2975,Blue Tea Towel Classic Design,Other/Unknown
2976,GLITTER HEART GARLAND WITH BELLS ,Decorative Items
2977,new england mug w gift box,Drinkware
2978,grow your own herbs set of 3,Other/Unknown
2979,frappucino scarf knitting kit,Other/Unknown
2980,"decoupage,greeting card,",Gifts & Cards
2981,FRAPPUCINO SCARF KNITTING KIT,Other/Unknown
2982,set/4 modern vintage cotton napkins,Vintage Items
2983,FUSCHIA FLOWER PURSE WITH BEADS,Decorative Items
2984,Pink Green Embroidery Cosmetic Bag,Bags & Boxes
2985,BLUE GREEN EMBROIDERY COSMETIC BAG,Bags & Boxes
2986,Gentleman Shirt Repair Kit ,Other/Unknown
2987,pair padded hangers pink check,Storage & Organization
2988,DOORMAT 3 SMILEY CATS,Other/Unknown
2989,small silver flower candle pot,Decorative Items
2990,Red Rose And Lace C/Cover,Other/Unknown
2991,RIBBON REEL LACE DESIGN ,Other/Unknown
2992,feltcraft hairband red and blue,Other/Unknown
2993,FELTCRAFT HAIRBAND PINK AND BLUE,Other/Unknown
2994,PINK FLORAL FELTCRAFT SHOULDER BAG,Bags & Boxes
2995,Feltcraft Doll Maria,Other/Unknown
2996,6 Ribbons Shimmering Pinks ,Other/Unknown
2997,Christmas Retrospot Star Wood,Decorative Items
2998,christmas retrospot heart wood,Decorative Items
2999,Painted Metal Star With Holly Bells,Decorative Items
3000,Christmas Tree Heart Decoration,Decorative Items
3001,GLITTER CHRISTMAS HEART ,Decorative Items
3002,glitter christmas star ,Decorative Items
3003,Bird Box Christmas Tree Decoration,Bags & Boxes
3004,Gold Mini Tape Measure ,Other/Unknown
3005,Card Suki Birthday,Gifts & Cards
3006,rainy ladies birthday card,Gifts & Cards
3007,Spaceboy Gift Wrap,Gifts & Cards
3008,wrap suki and friends,Other/Unknown
3009,Fancy Fonts Birthday Wrap,Other/Unknown
3010,BIRDHOUSE DECORATION MAGIC GARDEN,Decorative Items
3011,Birdcage Decoration Tealight Holder,Holders & Stands
3012,Ladle Love Heart Pink,Decorative Items
3013,ivory hanging decoration  heart,Decorative Items
3014,Fridge Magnets La Vie En Rose,Other/Unknown
3015,ROUND CAKE TIN VINTAGE GREEN,Vintage Items
3016,Bath Building Block Word,Other/Unknown
3017,brown  pirate treasure chest ,Other/Unknown
3018,OFFICE MUG WARMER PINK,Drinkware
3019,Diamante Bow Brooch Black Colour,Other/Unknown
3020,Diamante Bow Brooch Red Colour,Other/Unknown
3021,blue pudding spoon,Other/Unknown
3022,retro pink ball ashtray ,Other/Unknown
3023,Summer Fun Design Shower Cap,Other/Unknown
3024,STRIPY DESIGN SHOWER CAP,Other/Unknown
3025,SET/4 DAISY MIRROR MAGNETS,Other/Unknown
3026,Set/4 Bird Mirror Magnets ,Other/Unknown
3027,SET/4 BUTTERFLY MIRROR MAGNETS,Other/Unknown
3028,blue polkadot pudding bowl,Other/Unknown
3029,Madras Notebook Large ,Books & Stationery
3030,BLUE PAISLEY JOURNAL ,Other/Unknown
3031,RIBBON REEL FLORA + FAUNA ,Other/Unknown
3032,FRENCH STYLE EMBOSSED HEART CABINET,Decorative Items
3033,Skull Design Tv Dinner Tray,Other/Unknown
3034,CRYSTAL DIAMANTE EXPANDABLE RING,Other/Unknown
3035,diamante bow brooch red colour,Other/Unknown
3036,GREEN SWEETHEART BRACELET,Decorative Items
3037,Carnival Bracelet,Jewellery
3038,4 PEAR BOTANICAL DINNER CANDLES,Candles
3039,Cherry Crochet Food Cover,Other/Unknown
3040,PINK PAISLEY SQUARE TISSUE BOX ,Bags & Boxes
3041,VANILLA INCENSE 40 CONES IN TIN,Other/Unknown
3042,blue tea towel classic design,Other/Unknown
3043,Doctor'S Bag Soft Toy,Bags & Boxes
3044,POTTING SHED SEED ENVELOPES,Other/Unknown
3045,funky monkey mug,Drinkware
3046,Midnight Glamour Scarf Knitting Kit,Other/Unknown
3047,PINK  HEART SHAPE LOVE BUCKET ,Decorative Items
3048,green fern journal ,Other/Unknown
3049,Spaceboy Tv Dinner Tray,Other/Unknown
3050,lovely bonbon sticker sheet,Other/Unknown
3051,QUEEN OF SKIES LUGGAGE TAG,Other/Unknown
3052,blue polkadot passport cover,Other/Unknown
3053,economy luggage tag,Other/Unknown
3054,heart calculator,Decorative Items
3055,ocean scent candle in jewelled box,Bags & Boxes
3056,Biscuits Small Bowl Light Blue,Lighting
3057,Small Marshmallows Pink Bowl,Other/Unknown
3058,Cinammon Set Of 9 T-Lights,Lighting
3059,CAKE STAND WHITE TWO TIER LACE,Holders & Stands
3060,Red Retrospot Sugar Jam Bowl,Other/Unknown
3061,Metal Sign His Dinner Is Served,Other/Unknown
3062,Sandwich Bath Sponge,Other/Unknown
3063,assorted cheese fridge magnets,Other/Unknown
3064,BIG DOUGHNUT FRIDGE MAGNETS,Other/Unknown
3065,CERAMIC STRAWBERRY MONEY BOX,Bags & Boxes
3066,RED RETROSPOT BOWL,Other/Unknown
3067,BLUE PARTY BAGS ,Bags & Boxes
3068,PEARL CRYSTAL PUMPKIN T-LIGHT HLDR,Lighting
3069,LARGE HEART MEASURING SPOONS,Decorative Items
3070,kings choice biscuit tin,Other/Unknown
3071,WHITE STITCHED CUSHION COVER,Other/Unknown
3072,TV DINNER TRAY VINTAGE PAISLEY,Vintage Items
3073,Tea Time Des Tea Cosy,Other/Unknown
3074,SET OF 6 STRAWBERRY CHOPSTICKS,Other/Unknown
3075,PORCELAIN BUTTERFLY OIL BURNER,Other/Unknown
3076,"Bread Bin, Diner Style, Mint",Other/Unknown
3077,"bread bin, diner style, ivory",Other/Unknown
3078,"key fob , back door ",Other/Unknown
3079,"key fob , front  door ",Other/Unknown
3080,LADLE LOVE HEART RED ,Decorative Items
3081,LADLE LOVE HEART PINK,Decorative Items
3082,36 Doilies Dolly Girl,Other/Unknown
3083,ROSE 1 WICK MORRIS BOXED CANDLE,Bags & Boxes
3084,gardenia 3 wick morris boxed candle,Bags & Boxes
3085,set/6 pink bird t-light candles,Lighting
3086,Pack Of 60 Spaceboy Cake Cases,Other/Unknown
3087,Assorted Tutti Frutti  Fob Notebook,Books & Stationery
3088,"key fob , shed",Other/Unknown
3089,Paper Pocket Traveling Fan ,Other/Unknown
3090,Pink Heart Shape Egg Frying Pan,Decorative Items
3091,Airline Bag Vintage Jet Set Brown,Bags & Boxes
3092,airline bag vintage world champion ,Bags & Boxes
3093,15CM CHRISTMAS GLASS BALL 20 LIGHTS,Lighting
3094,tool box soft toy ,Bags & Boxes
3095,Sweetheart Wire Wall Tidy,Decorative Items
3096,LOVE HEART POCKET WARMER,Decorative Items
3097,Pink Heart Shape Photo Frame,Decorative Items
3098,Dolly Honeycomb Garland,Other/Unknown
3099,Rose Folkart Heart Decorations,Decorative Items
3100,Glitter Christmas Tree With Bells,Other/Unknown
3101,Large White Honeycomb Paper Bell  ,Other/Unknown
3102,white bell honeycomb paper ,Other/Unknown
3103,White Bell Honeycomb Paper Garland ,Other/Unknown
3104,dolly honeycomb garland,Other/Unknown
3105,Pink Knitted Egg Cosy,Other/Unknown
3106,HI TEC ALPINE HAND WARMER,Other/Unknown
3107,ENCHANTED BIRD COATHANGER 5 HOOK,Storage & Organization
3108,Garden Metal Sign ,Other/Unknown
3109,BLUE KNITTED EGG COSY,Other/Unknown
3110,WAY OUT METAL SIGN ,Other/Unknown
3111,Love Heart Pocket Warmer,Decorative Items
3112,PAPER BUNTING WHITE LACE,Other/Unknown
3113,French Wc Sign Blue Metal,Other/Unknown
3114,FRENCH BATHROOM SIGN BLUE METAL,Other/Unknown
3115,French Toilet Sign Blue Metal,Other/Unknown
3116,SAVOY ART DECO CLOCK,Clocks
3117,HALL CABINET WITH 3 DRAWERS,Other/Unknown
3118,doormat home sweet home blue ,Other/Unknown
3119,Blue Wire Spiral Candle Holder,Holders & Stands
3120,UTILTY CABINET WITH HOOKS,Storage & Organization
3121,hanging heart jar t-light holder,Holders & Stands
3122,S/12 VANILLA  BOTANICAL T-LIGHTS,Lighting
3123,SILVER PLATE CANDLE BOWL SMALL,Candles
3124,Money Box Pocket Money Design,Bags & Boxes
3125,Small Silver Flower Candle Pot,Decorative Items
3126,Small Hammered Silver Candlepot ,Candles
3127,love large wood letters ,Other/Unknown
3128,Ceramic Strawberry Money Box,Bags & Boxes
3129,set of 2 tins vintage bathroom ,Vintage Items
3130,WHITE CHRYSANTHEMUMS ART FLOWER,Decorative Items
3131,retro plastic daisy tray,Other/Unknown
3132,Cardholder Gingham Star,Holders & Stands
3133,pink heart shape photo frame,Decorative Items
3134,ASSORTED COLOUR T-LIGHT HOLDER,Holders & Stands
3135,white christmas garland stars trees,Decorative Items
3136,glitter christmas tree with bells,Other/Unknown
3137,Angel Decoration Stars On Dress,Decorative Items
3138,Garland With Stars And Bells,Decorative Items
3139,ANGEL DECORATION WITH LACE PADDED,Decorative Items
3140,antique glass heart decoration ,Decorative Items
3141,cinammon & orange wreath,Other/Unknown
3142,blue knitted egg cosy,Other/Unknown
3143,Christmas Retrospot Heart Wood,Decorative Items
3144,Sunset Check Hammock,Other/Unknown
3145,RETRO PLASTIC POLKA TRAY,Other/Unknown
3146,CALENDAR IN SEASON DESIGN,Other/Unknown
3147,White Christmas Star Decoration,Decorative Items
3148,soap dish brocante,Other/Unknown
3149,red daisy pocket book ,Books & Stationery
3150,WHITE BROCANTE SOAP DISH,Other/Unknown
3151,Abstract Circles Sketchbook ,Books & Stationery
3152,abstract circle journal ,Other/Unknown
3153,chrysanthemum  journal,Other/Unknown
3154,chrysanthemum sketchbook ,Books & Stationery
3155,Blue Paisley Notebook,Books & Stationery
3156,Asstd Multicolour Circles Mug,Drinkware
3157,6 egg house painted wood,Other/Unknown
3158,French Chateau Large Platter ,Other/Unknown
3159,HOT BATHS SOAP HOLDER,Holders & Stands
3160,Pink Oval Jewelled Mirror,Other/Unknown
3161,ENAMEL WASH BOWL CREAM,Other/Unknown
3162,WOOD STAMP SET THANK YOU,Other/Unknown
3163,ENVELOPE 50 CURIOUS IMAGES,Other/Unknown
3164,Milk Bottle With Glass Stopper ,Drinkware
3165,Folding Camping Scissor W/Knif & S,Other/Unknown
3166,hand open shape deco.white,Other/Unknown
3167,Pink Jewelled Mirror Trinket Tray,Other/Unknown
3168,SANDALWOOD FAN,Other/Unknown
3169,WHITE SAGE INCENSE,Other/Unknown
3170,AFGHAN SLIPPER SOCK PAIR,Other/Unknown
3171,set of 6 t-lights cacti ,Lighting
3172,Citronella Candle Flowerpot,Decorative Items
3173,small glass sundae dish clear,Other/Unknown
3174,vintage caravan gift wrap,Gifts & Cards
3175,GOLD EAR MUFF HEADPHONES,Other/Unknown
3176,paperweight save the planet,Other/Unknown
3177,200 red + white bendy straws,Other/Unknown
3178,set/3 vanilla scented candle in box,Bags & Boxes
3179,SET/3 ROSE CANDLE IN JEWELLED BOX,Bags & Boxes
3180,Doormat 3 Smiley Cats,Other/Unknown
3181,"Large Cake Towel, Chocolate Spots",Other/Unknown
3182,COFFEE MUG BLUE PAISLEY DESIGN,Drinkware
3183,6 rocket balloons ,Other/Unknown
3184,Red Retrospot Storage Jar,Other/Unknown
3185,"SET 3 RETROSPOT TEA,COFFEE,SUGAR",Other/Unknown
3186,POCKET BAG BLUE PAISLEY RED SPOT,Bags & Boxes
3187,pocket bag pink paisely brown spot,Bags & Boxes
3188,Lunch Box With Cutlery Retrospot ,Bags & Boxes
3189,RED RETROSPOT APRON ,Other/Unknown
3190,Victorian Sewing Box Medium,Bags & Boxes
3191,PHOTO FRAME 3 CLASSIC HANGING,Other/Unknown
3192,Vintage Cream Dog Food Container,Vintage Items
3193,essential balm 3.5g tin in envelope,Other/Unknown
3194,toadstool money box,Bags & Boxes
3195,Ceramic Strawberry Cake Money Bank,Other/Unknown
3196,pack of 12 circus parade tissues ,Other/Unknown
3197,SET3 BOOK BOX GREEN GINGHAM FLOWER ,Bags & Boxes
3198,porcelain butterfly oil burner,Other/Unknown
3199,Flowers  Stickers,Decorative Items
3200,butterflies stickers,Other/Unknown
3201,cake shop  sticker sheet,Other/Unknown
3202,SPACEBOY GIFT WRAP,Gifts & Cards
3203,Robot Birthday Card,Gifts & Cards
3204,CARD BIRTHDAY COWBOY,Gifts & Cards
3205,VINTAGE KID DOLLY CARD ,Gifts & Cards
3206,SPACEBOY BIRTHDAY CARD,Gifts & Cards
3207,72 Cake Cases Vintage Christmas,Vintage Items
3208,SET OF 16 VINTAGE SKY BLUE CUTLERY,Vintage Items
3209,"Tumbler, Baroque",Other/Unknown
3210,small polkadot chocolate gift bag ,Bags & Boxes
3211,large stripes chocolate gift bag,Bags & Boxes
3212,RIBBON REEL POLKADOTS ,Other/Unknown
3213,wooden skittles garden set,Other/Unknown
3214,Romantic Pinks Ribbons ,Other/Unknown
3215,Children'S Spaceboy Mug,Drinkware
3216,Card Gingham Rose ,Gifts & Cards
3217,garden path sketchbook,Books & Stationery
3218,small yellow babushka notebook ,Books & Stationery
3219,tea time oven glove,Other/Unknown
3220,wooden star christmas scandinavian,Decorative Items
3221,cubic mug flock blue on brown,Drinkware
3222,CUBIC MUG PINK POLKADOT,Drinkware
3223,NEW ENGLAND MUG W GIFT BOX,Drinkware
3224,red retrospot shopper bag,Bags & Boxes
3225,Gin + Tonic Diet Metal Sign,Other/Unknown
3226,area patrolled metal sign,Other/Unknown
3227,Vintage Keepsake Box Travelogue,Bags & Boxes
3228,Vintage Notebook Paris Days,Vintage Items
3229,"pink/white ""keep clean"" bullet bin",Other/Unknown
3230,SET OF 6 CAKE CHOPSTICKS,Other/Unknown
3231,Set Of 3 Butterfly Cookie Cutters,Other/Unknown
3232,Ceramic Heart Fairy Cake Money Bank,Decorative Items
3233,FRENCH BLUE METAL DOOR SIGN 9,Other/Unknown
3234,FRENCH BLUE METAL DOOR SIGN 8,Other/Unknown
3235,FRENCH BLUE METAL DOOR SIGN 5,Other/Unknown
3236,french blue metal door sign 0,Other/Unknown
3237,SET OF 36 MUSHROOM PAPER DOILIES,Other/Unknown
3238,advent calendar gingham sack,Other/Unknown
3239,Jumbo  Bag Baroque Black White,Bags & Boxes
3240,doormat welcome puppies,Other/Unknown
3241,doormat neighbourhood witch ,Other/Unknown
3242,DOORMAT WELCOME SUNRISE,Other/Unknown
3243,Vintage Union Jack Cushion Cover,Vintage Items
3244,carousel design washbag,Bags & Boxes
3245,VINTAGE CREAM DOG FOOD CONTAINER,Vintage Items
3246,SMALL POLKADOT CHOCOLATE GIFT BAG ,Bags & Boxes
3247,YELLOW SHARK HELICOPTER,Other/Unknown
3248,moroccan tea glass,Other/Unknown
3249,i'm on holiday metal sign,Other/Unknown
3250,moody girl door hanger ,Storage & Organization
3251,Do Not Touch My Stuff Door Hanger ,Storage & Organization
3252,TOXIC AREA  DOOR HANGER ,Storage & Organization
3253,skull design tv dinner tray,Other/Unknown
3254,SET OF 4 FAIRY CAKE PLACEMATS,Other/Unknown
3255,Blue Polkadot Washing Up Gloves,Other/Unknown
3256,set of 2 wooden market crates,Other/Unknown
3257,flower vine raffia food cover,Decorative Items
3258,BOUDOIR SQUARE TISSUE BOX,Bags & Boxes
3259,Ivy Heart Wreath,Decorative Items
3260,Cardholder Holly Wreath Metal,Holders & Stands
3261,la palmiera tile coaster,Other/Unknown
3262,Wake Up Cockerel Tile Coaster,Other/Unknown
3263,La Palmiera Tile Coaster,Other/Unknown
3264,jigsaw rabbit and birdhouse,Other/Unknown
3265,potting shed tea mug,Drinkware
3266,Blue Diner Wall Clock,Clocks
3267,GIN AND TONIC MUG,Drinkware
3268,white wire egg holder,Holders & Stands
3269,Small Heart Flowers Hook ,Storage & Organization
3270,box of vintage alphabet blocks,Bags & Boxes
3271,Plasmatronic Lamp,Other/Unknown
3272,4 burgundy wine dinner candles,Candles
3273,Silver Oval Shape Trinket Box,Bags & Boxes
3274,12 coloured party balloons,Other/Unknown
3275,wrap blue russian folkart,Other/Unknown
3276,Daisy Journal ,Other/Unknown
3277,DUSTY PINK CHRISTMAS TREE 30CM,Other/Unknown
3278,HANGING PHOTO CLIP ROPE LADDER,Other/Unknown
3279,Strawberry Shopper Bag,Bags & Boxes
3280,Pink Party Sunglasses,Other/Unknown
3281,posy candy bag,Bags & Boxes
3282,blackchristmas tree 30cm,Other/Unknown
3283,set of picture frame  stickers,Other/Unknown
3284,MIRRORED WALL ART PHOTO FRAMES,Other/Unknown
3285,CHRISTMAS TREE STAR DECORATION,Decorative Items
3286,Eucalyptus & Pinecone  Wreath,Other/Unknown
3287,DOORMAT PEACE ON EARTH BLUE,Other/Unknown
3288,jam jar with pink lid,Other/Unknown
3289,jam jar with green lid,Other/Unknown
3290,Set/4 Badges Balloon Girl,Other/Unknown
3291,NATURAL SLATE CHALKBOARD LARGE ,Other/Unknown
3292,Party Invites Woodland,Other/Unknown
3293,TUB 24 PINK FLOWER PEGS,Decorative Items
3294,SMALL DOLLY MIX DESIGN ORANGE BOWL,Other/Unknown
3295,biscuits small bowl light blue,Lighting
3296,small chocolates pink bowl,Other/Unknown
3297,POCKET MIRROR WOODLAND,Other/Unknown
3298,pack of 12 sticky bunnies,Other/Unknown
3299,PACK OF 12 STICKY BUNNIES,Other/Unknown
3300,Pocket Mirror Woodland,Other/Unknown
3301,SMALL HAMMERED SILVER CANDLEPOT ,Candles
3302,Party Metal Sign ,Other/Unknown
3303,Jumbo Storage Bag Skulls,Bags & Boxes
3304,Traditional Wooden Skipping Rope,Other/Unknown
3305,sweeties  stickers,Other/Unknown
3306,Sweet Pudding Sticker Sheet,Other/Unknown
3307,CAKE SHOP  STICKER SHEET,Other/Unknown
3308,alphabet stencil craft,Other/Unknown
3309,ribbon reel polkadots ,Other/Unknown
3310,BROWN CHECK CAT DOORSTOP ,Other/Unknown
3311,glass jar english confectionery,Other/Unknown
3312,"tumbler, new england",Other/Unknown
3313,heart shape wireless doorbell,Decorative Items
3314,Milk Pan Red Retrospot,Other/Unknown
3315,PARTY METAL SIGN ,Other/Unknown
3316,ROUND CONTAINER SET OF 5 RETROSPOT,Other/Unknown
3317,set/6 turquoise butterfly t-lights,Lighting
3318,Set/6 Pink  Butterfly T-Lights,Lighting
3319,SET/4 SKULL BADGES,Other/Unknown
3320,LIPSTICK PEN RED,Other/Unknown
3321,Pack Of 12 Spaceboy Tissues,Other/Unknown
3322,PACK OF 12 PINK POLKADOT TISSUES,Other/Unknown
3323,enamel fire bucket cream,Other/Unknown
3324,ENAMEL BREAD BIN CREAM,Other/Unknown
3325,toy tidy pink polkadot,Toys & Games
3326,no singing metal sign,Other/Unknown
3327,FELTCRAFT PRINCESS OLIVIA DOLL,Other/Unknown
3328,columbian candle rectangle,Candles
3329,SET/6 GREEN SPRING PAPER CUPS,Drinkware
3330,FUNKY WASHING UP GLOVES ASSORTED,Other/Unknown
3331,assorted tutti frutti large purse,Other/Unknown
3332,English Rose Garden Secateurs,Other/Unknown
3333,Assorted Tutti Frutti Large Purse,Other/Unknown
3334,coffee scent pillar candle,Candles
3335,small hammered silver candlepot ,Candles
3336,Pink Rose Washbag,Bags & Boxes
3337,GARDENIA 1 WICK MORRIS BOXED CANDLE,Bags & Boxes
3338,SUNSET CHECK HAMMOCK,Other/Unknown
3339,3 ROSE MORRIS BOXED CANDLES,Bags & Boxes
3340,Large Yellow Babushka Notebook ,Books & Stationery
3341,large red babushka notebook ,Books & Stationery
3342,GUMBALL MONOCHROME COAT RACK,Other/Unknown
3343,SILVER LATTICE VANILLA CANDLE POT,Candles
3344,4 Wildflower Botanical Candles,Decorative Items
3345,PACK OF 12 BLUE PAISLEY TISSUES ,Other/Unknown
3346,Gardenia 1 Wick Morris Boxed Candle,Bags & Boxes
3347,pack 3 iron on dog patches,Other/Unknown
3348,frog sock puppet,Other/Unknown
3349,daisy journal ,Other/Unknown
3350,daisy notebook ,Books & Stationery
3351,Lets Go Shopping Cotton Tote Bag,Bags & Boxes
3352,BLACK FINE BEAD NECKLACE W TASSEL,Jewellery
3353,FIRE POLISHED GLASS NECKL BRONZE,Other/Unknown
3354,Pink Union Jack  Luggage Tag,Other/Unknown
3355,Union Jack Flag Luggage Tag,Other/Unknown
3356,GLITTER CHRISTMAS STAR ,Decorative Items
3357,Round Pink Heart Mirror,Decorative Items
3358,gold cosmetic bag pink star,Bags & Boxes
